{
    "id": 1057,
    "lang": "pt",
    "is_original": true,
    "title": "Coutinho (D. Manuel)",
    "fl": "C",
    "original_title": "Coutinho (D. Manuel)",
    "body": "Tendo o prelado diocesano D. José de Sousa de Castelo Branco saido da\n Madeira em Junho de 1715 e renunciado o bispado em 1721, nomeou D. João V bispo do Funchal D. Manuel\n Coutinho, a 25 de Novembro de 1722, mas só foi confirmado pela Santa Sé a 19 de Fevereiro de 1725, em\n virtude das desinteligencias que então se deram entre o govêrno português e a curia romana.\n\n Nasceu D. Manuel Coutinho na Vila Nova de Anços em 1671 e era filho de Nuno Alvares Pereira e de D. Inez\n Micaela Pereira, pessoas nobres e abastadas, que ali tinham a sede do seu morgadio. Doutorou-se em\n teologia na Universidade de Coimbra em 1699, e recebeu a sagração episcopal das mãos do patriarca D.\n Tomaz de Almeida, a 13 de Maio de 1725.\n\n Saíu de Lisboa no principio de Junho de 1725, mas tendo o navio de guerra que o conduzia feito escala por\n Mazagão, exerceu ali as funções episcopais durante alguns dias, e só chegou ao Funchal a 22 de Julho\n daquele ano, em que assumiu a direcção dos negocios desta diocese.\n\n Nas cronicas madeirenses que nos foi possivel consultar, poucas referencias encontrámos á sua accão\n episcopal entre nós. Depois de 15 anos de episcopado, foi nomeado bispo de Lamego, mas continuou na\n Madeira até o dia 25 de Fevereiro de 1741, em que saiu para o continente do reino. Não chegou a tomar\n posse da sua nova diocese, porque, quando se dirigia á cidade de Lamego, a morte surpreendeu-o na vila de\n Soure, a 7 de Agôsto de 1742.",
    "categories": [
        "history"
    ],
    "freguesias": [],
    "locations": {},
    "people": {
        "D. José de Sousa de Castelo Branco": [
            "Prelado diocesano"
        ],
        "D. João V": [
            "Bispo do Funchal"
        ],
        "Nuno Alvares Pereira": [
            "Pai de D. Manuel Coutinho"
        ],
        "D. Inez Micaela Pereira": [
            "Mãe de D. Manuel Coutinho"
        ],
        "D. Tomaz de Almeida": [
            "Patriarca"
        ]
    },
    "years": {
        "1715": [
            "Prelado diocesano D. José de Sousa de Castelo Branco saido da\n Madeira"
        ],
        "1721": [
            "Renunciado o bispado"
        ],
        "1722": [
            "Nomeou D. João V bispo do Funchal D. Manuel\n Coutinho"
        ],
        "1725": [
            "Recebeu a sagração episcopal das mãos do patriarca D.\n Tomaz de Almeida"
        ],
        "1671": [
            "Nasceu D. Manuel Coutinho na Vila Nova de Anços"
        ],
        "1699": [
            "Doutorou-se em\n teologia na Universidade de Coimbra"
        ],
        "1741": [
            "Saiu para o continente do reino"
        ],
        "1742": [
            "Morte surpreendeu-o na vila de\n Soure"
        ]
    }
}