{
    "id": 1165,
    "lang": "pt",
    "is_original": true,
    "title": "Discursos",
    "fl": "D",
    "original_title": "Discursos",
    "body": "Para não dar uma demasiada extensão no artigo Bibliografia, reservámos para este lugar a rápida enumeração de várias peças oratórias publicadas por indivíduos naturais deste arquipelago, ou cujo assunto possa de qualquer modo interessar á historia destas ilhas. A pesar de muito incompleta, pode esta relação servir de subsidio para o estudo da bibliografia madeirense. As diversas espécies de que pudemos alcançar noticia, vão aqui indicadas sem obediência á selecção de assuntos ou ainda á ordem cronológica São elas: \n\n> Oratio in funere Philippi II, Romae, 1599, \n> Gratulatio de S. Pontif. Paulo V, Romae, 1607, e in funere Seraphinae a Portugalis Joannis Brigantiae Ducis filiae etc., Romae, 1604, pelo dr. Manuel Constantino; \n> Sermão da Conceição de Nossa Senhora em a Igreja Collegiada de São Pedro da cidade do Funchal. Rochela, 1656, e Sermão da Visitação da Mãy de Deus Rochela, 1654, pelo Dr. Francisco de Castro; \n> Sermão penegyrico em a solemnissima festa que o reverendo cabido da Sé do Funchal fez em 13 de Junho de 1697, por Pedro Correia Barbosa; Sermões dos Domingos, 1 Parte, Lisboa, 1629, por Fr. Gregorio Baptista; \n> Pregação da beatificaçâo de S. Francisco Xavier, 1621, pelo padre Luiz de Morais; \n> Sermão na festividade do Coração de Jesus, 1733, Tardes de Quaresma, 1738, Sermão pelas melhoras do Infante, 1739, Sermão pelas melhoras del Rey, 1742, Sermão de São Luiz Rey, 1746, Sermão de Acçam de Graças a S. Luiz, 1748, Panegyrico fúnebre do Senhor Rey D. Joâo V, 1750, Panegyrico fúnebre da Rainha de Portugal, 1755 , Sermão da Conceição, 1757 e Oração Académica, 1757, pelo padre Manuel Rodrigues, \n> Orações que pela feliz inauguração do Seminário na cidade do Funchal, compôz e recitou Francisco Manuel de Oliveira, 1789; \n> Oração de acção de graças que na solemnidade do anniversario do faustissimo dia 28 de Janeiro de 1821 prégou na Igreja Cathedral da Sé do Funchal o vigário de São Jorge Joâo Manuel de Freitas Branco, 1822; \n> Oração de acção de graças pregada na igreja Cathedral da Sé do Funchal em 8 de Julho de 1823 pela feliz restauraçâo de el-rei IV. S. ao throno dos seus maiores, 1823, e Sermâo pregado na egreja de São Martinho, 1823, por Fr. José Cupertino; \n> Oração na abertura dos estudos do seminario episcopal do Funchal pronunciada em XVII de Outubro de MDCCCXII, por um dos professores do mesmo Seminário, 1814; Collecçao das peças recitadas nas varandas da casa do Senado no real theatro de S. Joâo pelo Dr. José Manuel da Veiga, 1821; \n> Oração fúnebre nas exequias do Sr. D. Miguel de Bragança, Rio de Janeiro, 1867; \n> Oração de S. M. El-Rei D. Pedro V, Rio de Janeiro,1862 e Oração fúnebre recitada nas exéquias celebradas na igreja de Santa Clara do Funchal, por alma de Pio IX, 1878, pelo Dr. Patrício Moniz; \n> Discursos do conde de Tojal proferidos na câmara dos dignos Pares, 1848; \n> Discurso pronunciado na assembleia geral da Companhia Fabril de Assucar Madeirense, pelo cónego Feliciano João Teixeira, 1873; Sermôes do cónego Alfredo Cesar de Oliveira, I parte, 1868; \n> Discurso proferido na Camara dos Deputados na sessão de 7 de Maio de 1883, 1883, Discurso proferido na Câmara dos Deputados na sessão de 13 de Fevereiro de 1884, 1884, e Discurso proferido na Câmara dos deputados na sessão de 7 de Julho de 1888, 1888, por Manuel José Vieira; \n> 0 Dogma da Imaculada Conceição de Maria, 1880, pelo padre Dr. José Gonçalves de Aguiar; \n> Allegação da defeza por parte de José Vieira de Castro proferida em 30 de Novembro 1870, publicada no livro Processo e julgamento de José Vieira de Castro, 1870, e Discurso proferido na Câmara dos Deputados na sessão de 15 de Março de 1878, 1878, por Jaime Constantino de Freitas Moniz; \n> Cousas Portuguezas. Conferencia realisada no salão do theatro da Trindade em 8 de Julho de 1884, 1885, por José Julio Rodrigues; Sermão pregado no dia 12 de Setembro de 1813, anniversario da sagração episcopal de D. Matheus de Abreu Pereira, bispo de S. Paulo, pregado por Francisco do Monte Alverne, que vem publicado nas Obras deste grande orador sagrado brasileiro; \n> Oração que no aniversário da sagração episcopal de D. Matheus Abreu Pereira recitou na Cathedral de S. Paulo a 14 de Setembro de 1817, 1818, pelo padre Joaquim Antonio Fernandes Saldanha; \n> Incompatibilidades Políticas, discursos proferidos na Camara dos Pares,1889, 3ª ed., por D. Luiz da Cãmara Leme; \n> Discurso recitado na sala da Associação Catholica do Funchal, no dia 2 de Fevereiro de 1884, 1884, por Alfredo de Paula Sardinha;\n\nObras de D. Ayres de Ornellas de Vasconcellos, 1882, que contêm nove discursos proferidos no Funchal pelo bispo D. Ayres; Discursos proferidos na Camara dos Deputados nas sessões de 15 e 16 de Janeiro de 1885, 1885, pelos deputados Consiglieri Pedroso, Pedro Maria Gonçalves e Elias Garcia; Discurso proferido nas solemnes exéquias maçonicas de Elias Garcia, celebradas no templo da Loja Liberdade aos 18 de Julho de 1891, 1891, por Azevedo Ramos; Discurso acerca do estado anárquico em que se encontra o districto do Funchal, pronunciado na Camara dos Deputados na sessão de 17 de Março de 1903, por João Augusto Pereira; Discursos pronunciados no Paço episcopal do Funchal nos anos de 1896, 1897, 1898 e 1899, 1900, por João Baptista de Freitas Leal; Discurso pronunciado, no Paço Episcopal em 1900, 1900, por João Baptista de Freitas Leal, e outros discursos pelo mesmo, relativos ao ano de 1901, 1902, 1903, 1907 e 1908, também pronunciados no Paço Episcopal do Funchal e, publicados em cinco opúsculos no mesmo ano que foram proferidos; A escravidão da Egreja em Portugal, Discurso proferido na Câmara dos Deputados na sessão de 5 de Maio de 1905, 1905, Necessidade do Descanso Dominical. Discurso proferido na Camara dos deputados na sessão de 6 de Fevereiro de 1907, 1907 e A Situação da Madeira. Discurso proferido na Câmara dos Deputados na sessão de 19 de Fevereiro de 1907, 1907, pelo cónego Antonio Homem de Gouveia, A Immaculada Conceiçao. Discurso proferido na Egreja da Sé (Funchal no dia 8 de Dezembro de 1906, 1907, pelo cónego Antonio M. Pereira Ribeiro; Á memória de Leão XIII. Oração funebre pronunciada na Sé Cathedral do Funchal a 12 de Novembro de 1903, 1904, pelo padre Jose Pereira da Silva; A Bandeira Portuguesa. Allocução proferida no Campo de D. Carlos I, do Funchal, no dia 20 de Janeiro de 1907, 1907; Elogio Fúnebre de Hintze Ribeiro, proferido nas exéquias... celebradas na Sé do Funchal a 2 de Setembro de 1907, 1907 e Brevi Vivens Tempore. Elogio fúnebre proferido na Sé Cathedral do Funchal em 31 de Março de 1908, nas exéquias por alma de el-rei D. Carlos e o príncipe D. Luiz Filipe, 1908, pelo padre Luiz Alves Martins; A Região Amazonica. Seu passado, presente e futuro. Conferencia realisada no Palácio Monroe, a 29 de Outubro de 1913, Rio de Janeiro, 1913, por José Simão da Costa; oração Fúnebre nas exéquias do S. Pontífice Pio X, proferida na Cathedral do Funchal em 2 de Dezembro de 1914, pelo padre Manuel Gomes Jardim; Resumo da conferencia realisada na Associação Comercial do Funchal em 15 de Outubro de 1905, 1905, por Antonio Batalha Reis; Sermão do SS. Sacramento, 1912, pelo padre Manuel Gomes Jardim; El rei D. Luiz Iª Oraçâo Fúnebre, Funchal, 1890, pelo cónego A. Aires Pacheco; Discurso pronunciado na reunião eleitoral do partido progressista a vinte e cinco de Março, Funchal, 1870, Discurso de abertura pronunciado na escola Medico-cirurgica do Funchal no dia 15 de Maio de 1867, 1867 e Discurso pronunciado em 20 de Março de 1876 na sessão da abertura da Escola Central da Associação de Protecção e Instrução do Sexo Feminino do Funchal, 1876, pelo Dr. João da Câmara Leme Homem de Vasconcelos; Discursos e trabalhos parlamentares, 1887, por Luiz Antonio Gonçalves de Freitas.",
    "categories": [
        "culture",
        "history"
    ],
    "freguesias": [],
    "locations": {},
    "people": {},
    "years": {
        "1599": [
            "Oratio in funere Philippi II, Romae"
        ],
        "1607": [
            "Gratulatio de S. Pontif. Paulo V, Romae, e in funere Seraphinae a Portugalis Joannis Brigantiae Ducis filiae etc., Romae"
        ],
        "1604": [
            "Gratulatio de S. Pontif. Paulo V, Romae, e in funere Seraphinae a Portugalis Joannis Brigantiae Ducis filiae etc., Romae"
        ],
        "1656": [
            "Sermão da Conceição de Nossa Senhora em a Igreja Collegiada de São Pedro da cidade do Funchal. Rochela"
        ],
        "1654": [
            "Sermão da Visitação da Mãy de Deus Rochela"
        ],
        "1697": [
            "Sermão penegyrico em a solemnissima festa que o reverendo cabido da Sé do Funchal fez em 13 de Junho"
        ],
        "1629": [
            "Sermões dos Domingos, 1 Parte, Lisboa"
        ],
        "1621": [
            "Pregação da beatificaçâo de S. Francisco Xavier"
        ],
        "1733": [
            "Sermão na festividade do Coração de Jesus"
        ],
        "1738": [
            "Tardes de Quaresma"
        ],
        "1739": [
            "Sermão pelas melhoras do Infante"
        ],
        "1742": [
            "Sermão pelas melhoras del Rey"
        ],
        "1746": [
            "Sermão de São Luiz Rey"
        ],
        "1748": [
            "Sermão de Acçam de Graças a S. Luiz"
        ],
        "1750": [
            "Panegyrico fúnebre do Senhor Rey D. Joâo V"
        ],
        "1755": [
            "Panegyrico fúnebre da Rainha de Portugal"
        ],
        "1757": [
            "Sermão da Conceição, Oração Académica"
        ],
        "1789": [
            "Orações que pela feliz inauguração do Seminário na cidade do Funchal, compôz e recitou Francisco Manuel de Oliveira"
        ],
        "1822": [
            "Oração de acção de graças que na solemnidade do anniversario do faustissimo dia 28 de Janeiro de 1821 prégou na Igreja Cathedral da Sé do Funchal o vigário de São Jorge Joâo Manuel de Freitas Branco"
        ],
        "1823": [
            "Oração de acção de graças pregada na igreja Cathedral da Sé do Funchal pela feliz restauraçâo de el-rei IV. S. ao throno dos seus maiores, Sermâo pregado na egreja de São Martinho"
        ],
        "1814": [
            "Oração na abertura dos estudos do seminario episcopal do Funchal pronunciada em XVII de Outubro de MDCCCXII, por um dos professores do mesmo Seminário"
        ],
        "1867": [
            "Oração fúnebre nas exequias do Sr. D. Miguel de Bragança, Rio de Janeiro",
            "Discurso de abertura pronunciado na escola Medico-cirurgica do Funchal"
        ],
        "1862": [
            "Oração de S. M. El-Rei D. Pedro V, Rio de Janeiro"
        ],
        "1878": [
            "Oração fúnebre recitada nas exéquias celebradas na igreja de Santa Clara do Funchal, por alma de Pio IX"
        ],
        "1848": [
            "Discursos do conde de Tojal proferidos na câmara dos dignos Pares"
        ],
        "1873": [
            "Discurso pronunciado na assembleia geral da Companhia Fabril de Assucar Madeirense, pelo cónego Feliciano João Teixeira"
        ],
        "1868": [
            "Sermôes do cónego Alfredo Cesar de Oliveira, I parte"
        ],
        "1883": [
            "Discurso proferido na Camara dos Deputados na sessão de 7 de Maio de 1883, Discurso proferido na Câmara dos Deputados na sessão de 13 de Fevereiro de 1884, e Discurso proferido na Câmara dos deputados na sessão de 7 de Julho de 1888, por Manuel José Vieira"
        ],
        "1880": [
            "0 Dogma da Imaculada Conceição de Maria, pelo padre Dr. José Gonçalves de Aguiar"
        ],
        "1870": [
            "Allegação da defeza por parte de José Vieira de Castro proferida em 30 de Novembro 1870, publicada no livro Processo e julgamento de José Vieira de Castro, e Discurso proferido na Câmara dos Deputados na sessão de 15 de Março de 1878, por Jaime Constantino de Freitas Moniz",
            "Discurso pronunciado na reunião eleitoral do partido progressista"
        ],
        "1884": [
            "Discurso recitado na sala da Associação Catholica do Funchal, no dia 2 de Fevereiro de 1884, por Alfredo de Paula Sardinha"
        ],
        "1813": [
            "Sermão pregado no dia 12 de Setembro de 1813, anniversario da sagração episcopal de D. Matheus de Abreu Pereira, bispo de S. Paulo, pregado por Francisco do Monte Alverne, que vem publicado nas Obras deste grande orador sagrado brasileiro"
        ],
        "1817": [
            "Oração que no aniversário da sagração episcopal de D. Matheus Abreu Pereira recitou na Cathedral de S. Paulo a 14 de Setembro de 1817, pelo padre Joaquim Antonio Fernandes Saldanha"
        ],
        "1889": [
            "Incompatibilidades Políticas, discursos proferidos na Camara dos Pares, 3ª ed., por D. Luiz da Cãmara Leme"
        ],
        "1882": [
            "Obras de D. Ayres de Ornellas de Vasconcellos"
        ],
        "1885": [
            "Discursos proferidos na Camara dos Deputados"
        ],
        "1891": [
            "Discurso proferido nas solemnes exéquias maçonicas de Elias Garcia"
        ],
        "1903": [
            "Á memória de Leão XIII"
        ],
        "1896": [
            "Discursos pronunciados no Paço episcopal do Funchal"
        ],
        "1897": [
            "Discursos pronunciados no Paço episcopal do Funchal"
        ],
        "1898": [
            "Discursos pronunciados no Paço episcopal do Funchal"
        ],
        "1899": [
            "Discursos pronunciados no Paço episcopal do Funchal"
        ],
        "1900": [
            "Discursos pronunciados no Paço episcopal do Funchal"
        ],
        "1901": [
            "Discursos pronunciados no Paço episcopal do Funchal"
        ],
        "1902": [
            "Discursos pronunciados no Paço episcopal do Funchal"
        ],
        "1907": [
            "Elogio Fúnebre de Hintze Ribeiro"
        ],
        "1908": [
            "Brevi Vivens Tempore"
        ],
        "1905": [
            "Resumo da conferencia realisada na Associação Comercial do Funchal"
        ],
        "1906": [
            "A Immaculada Conceiçao"
        ],
        "1913": [
            "A Região Amazonica. Seu passado, presente e futuro"
        ],
        "1914": [
            "Oração Fúnebre nas exéquias do S. Pontífice Pio X"
        ],
        "1912": [
            "Sermão do SS. Sacramento"
        ],
        "1890": [
            "El rei D. Luiz Iª Oraçâo Fúnebre"
        ],
        "1876": [
            "Discurso pronunciado em sessão da abertura da Escola Central da Associação de Protecção e Instrução do Sexo Feminino do Funchal"
        ],
        "1887": [
            "Discursos e trabalhos parlamentares"
        ]
    }
}