{
    "id": 174,
    "lang": "pt",
    "is_original": true,
    "title": "Aluviões",
    "fl": "A",
    "original_title": "Aluviões",
    "body": "Na relação que abaixo publicamos vão indicadas todas as aluviões que tem havido na Madeira e sobre as quais conseguimos obter alguns esclarecimentos. É de advertir, porém, que a aluvião de 1724 não foi a primeira que causou prejuízos, pois que Mouquet que esteve aqui em 1601, diz, embora não precise datas, “que as águas que descem das montanhas algumas vezes destroem pontes e casas em toda a ilha”.\n\n## 18 de Novembro de 1724.\n\nOs estragos desta aluvião fizeram-se principalmente sentir na freguesia de Machico, morrendo ali 26 pessoas e abatendo-se mais de 80 habitações. No Anno Histórico, referindo-se o Padre Francisco de Santa Maria á aluvião de 1724, diz que “padeceu a ilha da Madeira uma tormenta e dilúvio tão grande, que destruiu a vila de Machico, parte da de Santa Cruz e muitos outros logares e sítios da mesma ilha, e também a cidade do Funchal experimentou grande dano e muitas ruínas, assim nas suas muralhas como na povoação, com a enchente da Ribeira do Pinheiro (Santa Luzia) que a divide”\n\n## 18 de Novembro de 1765.\n\nEm virtude das grandes chuvas, cresceram muito neste dia as ribeiras que atravessam o Funchal, sendo destruída a Ponte da Praça e sofrendo bastante outras pontes da cidade. As águas da Ribeira da Praça ou de João Gomes arrastaram para o mar o inglês Moita (?), o qual nunca mais apareceu.\n\n## 9 de Outubro de 1803.\nFoi neste dia tristemente memorável que uma grande inundação assolou os campos da Madeira e destruiu uma parte considerável da cidade, causando não somente enormes prejuízos materiais mas também a perda da vida de alguns centenares de pessoas. Pode sem duvida considerar-se a maior calamidade que tem ferido esta ilha no largo período de cinco séculos. Longe iríamos se quiséssemos fazer uma descrição pormenorizada desta tremenda catástrofe e por isso nos limitamos a traçar umas breves notas, rapidamente colhidas nas crónicas do tempo.\n\nTinham caído algumas chuvas, com várias intermitências, nos dez ou doze dias que precederam o 9 de Outubro de 1803. Neste dia, pelas 8 horas da manhã, começou a cair no Funchal uma chuva não muito copiosa, que se manteve inalteravelmente até ás 8 horas da noite, mas nada fazia recear que estivesse iminente uma tão terrível inundação. Principiou então a ouvir-se o ribombar do trovão e a chuva, acompanhada de algum vento, caía já em verdadeiras catadupas. Ás 8 horas e meia as águas das ribeiras galgavam as suas margens e espalhavam-se com grande ruído pelas ruas laterais, começando a sua obra de destruição e de morte. Estava-se em pleno dilúvio.\n\nÉ indescritível o pavor que se apossou dos habitantes, que maior se tornou ainda pelo inopinado do acontecimento, que a um grande numero apanhou de surpresa e sem possibilidade de pôr-se ao abrigo do perigo que a todos ameaçava. A morte surpreendeu a muitos na fuga, arrastados pela violência das correntes ou atingidos pelas derrocadas das casas e paredes que se desmoronavam.\n\nFoi o bairro de Santa Maria Maior o mais sacrificado pela tempestade. A ribeira de João Gomes, com a abundância e violência das águas, rebentou em três diversos pontos, formando outras tantas impetuosas correntes que causaram os maiores estragos e vitimaram algumas dezenas de pessoas. Ruas inteiras e inúmeras casas de habitação e outros prédios foram arrastados para o mar, incluindo a igreja paroquial, conhecida pelo nome de Nossa Senhora do Calhau e que ficava na margem esquerda da ribeira, entre as actuais rua de Santa Maria e rua Nova de Santa Maria. Numa casa desta rua ficaram soterrados 21 indivíduos e num prédio do Pelourinho morreram um súbdito inglês e 15 pessoas de família. Calcula-se que só no bairro de Santa Maria Maior tivessem perecido cerca de 200 pessoas por ocasião da aluvião.\n\nOs prédios marginais da ribeira de Santa Luzia também sofreram bastante. Acima da ponte do Bom Jesus as águas tomaram novo curso por uma e outra margem daquela corrente e, sobretudo na rua dos Ferreiros, causaram estragos consideráveis, tendo-se abatido diversas casas de habitação e lojas de comercio. O mesmo aconteceu na rua dos Tanoeiros e a vários prédios que ficavam na margem esquerda daquela ribeira e que formavam a rua Direita, prédios que foram arrastados pela violência da corrente.\n\nDiz uma relação coeva do acontecimento:\n\n\"Ruas inteiras desapareceram com seus habitantes e outras inundadas de água e lama deixaram os proprietários e inquilinos reduzidos á extrema indigência. Uma grande parte da freguesia de Santa Maria Maior, assim como a sua igreja, a mais antiga da cidade, não existem com uma boa porção dos seus infelizes moradores: o resto disperso cá e lá, inundado e abandonado, oferece aos olhos do homem sensível um objecto de dor, de ruína e consternação. As ruas chamadas Direita, Tanoeiros, Valverde, Santa Maria, Hospital Velho e outras foram ao mar com uma incrível multidão de habitantes”.\n\nFora do Funchal, as povoações que mais sofreram com a horrível inundação foram Machico, Santa Cruz, Campanário, Ribeira Brava e Calheta, tendo sido relativamente pequenos os prejuízos causados nas freguesias do norte da ilha.\n\nCom respeito á vila de Machico, lê-se o seguinte no arquivo da respectiva igreja paroquial: “...demoliu a muralha da ribeira, abateu a ponte e invadiu a vila de tal sorte que chegaram as águas á altura de três côvados na igreja e em todas as ruas. Esta inundacão prometeu a todos a morte; mas um prodígio evidente fez que se salvassem todos, excepto catorze pessoas que pereceram arrastadas pelas águas e aterrados nas casas”. Também demoliu a antiga e histórica capela do Senhor dos Milagres, tendo a respectiva imagem sido encontrada dias depois, no alto mar, por uma galera americana, que a fez depositar na Sé do Funchal.\n\nForam igualmente consideráveis os estragos que a aluvião produziu nas outras freguesias citadas, onde também houve a perda de muitas vidas.\n\nSão bastantes discordes as informações contemporâneas dos acontecimentos, com relação ao numero de pessoas que sucumbiram, vitimas daquelas inundações, chegando uma narrativa do terrível caso a computar em cerca de mil os indivíduos mortos e desaparecidos. Parece não estar muito distanciado da verdade quem fixar em seiscentos o numero aproximado dos que morreram, sendo a maior parte no concelho do Funchal.\n\nEra então governador e capitão general D. José Manuel da Câmara, que fez publicar sem demora um edital adoptando as imediatas e prontas providencias que as circunstancias de momento aconselhavam. O primeiro cuidado das autoridades foi procurar abrigo para os que tinham ficado sem casa de habitação e que eram em numero muito avultado. Os edifícios públicos, varias repartições de serviço do estado, muitas dependências das igrejas, dos quartéis e das fortalezas e ainda bastantes casas particulares foram destinadas a dar alojamento provisório àqueles indivíduos. Entre as medidas tomadas pelo governador, destaca-se a da absoluta proibição de serem elevados os preços dos géneros de consumo, sob pena de severos castigos infligidos aos transgressores.\n\nA principal causa dos males produzidos pela aluvião foi a falta do encanamento das ribeiras. Embora tardiamente, resolveu o governo da metrópole realizar esse tão desejado melhoramento, enviando á Madeira o brigadeiro Reinaldo Oudinot encarregado de dirigir os respectivos trabalhos e que aqui chegou a 19 de Fevereiro de 1804. Revelou a maior competência no desempenho do cargo em que fora investido e nele desenvolveu uma pasmosa actividade, conseguindo num período relativamente curto de tempo fazer o encanamento das três ribeiras que atravessam o Funchal. Em Dezembro de 1800, comunicava ele ao governo central que, a pesar dos grandes temporais e fortes invernias que pouco antes houvera, as muralhas tinham resistido ao embate violento das águas e oferecido uma prova evidente da solidez da sua construção. Oudinot morreu nesta cidade a 11 de Fevereiro de 1807 e em memória dos seus serviços foi dado o seu nome á rua que fica na margem esquerda da ribeira de João Gomes, entre o Campo da Barca e a praça dos Lavradores.\n\nUm pormenor interessante: tendo ficado de pé a capela-mor da igreja de Nossa Senhora do Calhau, mandou a provisão régia de 12 de Março de 1805 que ela se conservasse no mesmo estado em que a deixara a aluvião, como lembrança, para os vindouros, do acontecimento que mais funesto fora para os habitantes desta ilha. Em Dezembro de 1835 foi demolida parte da igreja que a aluvião respeitara e ali se construiu o mercado União, que há pouco se destruiu para o alargamento da rua que ali passa.\n\n## 26 de Outubro de 1815\nDepois da grande aluvião de 9 de Outubro de 1803 foi talvez a maior que tem assolado esta ilha. Numa representação que, sôbre os estragos causados por esta inundação de 26 de Outubro de 1815, dirigiu a câmara municipal do Funchal ao Príncipe Regente D. João, se afirma que esta foi *incomparavelmente maior do que a aluvião de 1803+, mas, nem pelo numero de vitimas nem pelos prejuízos que causou, atingiu as proporções da outra, a pesar das enormes perdas que acarretou aos habitantes do Funchal.\n\nComo em outras ocasiões aconteceu, foram as correntes impetuosas das ribeiras que ocasionaram os maiores prejuízos. Especialmente nalguns pontos das margens das ribeiras que não tinham muralhas a ampararem e a dirigirem o curso das águas, saíram estas fora do seu leito, galgaram os terrenos marginais e abriram novo caminho, através das ruas e casas, causando não só incalculaveis estragos, como produzindo o maior pânico entre os habitantes, alguns dos quais foram vitimas do ímpeto indomável da corrente. Foi o que aconteceu com as águas da ribeira de S. João que, procurando novo percurso, arrastaram na sua violência cerca de vinte casas desde a ponte de S. Paulo, ao fim da rua da Carreira, até á foz da mesma ribeira.\n\nNas ruas marginais da ribeira de Santa Luzia, também foram grandes os estragos, ficando danificadas algumas casas e em alguns pontos as muralhas da mesma ribeira.\n\nPor toda a ilha houve prejuízos consideráveis e morreram várias pessoas, arrastadas pela violência das correntes.\n\nOs horrores da grande aluvião de 1803, ainda bem presentes na memória de todos, fizeram aumentar o pânico nos habitantes, que, na sua grande maioria, julgaram que não havia possibilidade de escapar á morte, que para eles parecia inevitável.\n\n## 28 de Outubro de 1842\nHavia quinze dias que quasi interruptamente caia um pequeno orvalho. As 9 horas da manhã do dia 24 de Outubro as chuvas eram já abundantes, e ás 3 horas da tarde as águas pluviais caiam a torrentes. As águas das ribeiras saíram dos seus leitos e espalharam-se impetuosamente pelos terrenos marginais, causando grandes estragos.\n\nFicaram completamente inundadas as ruas do bairro de Santa Maria Maior, o Pelourinho, a rua dos Medinas e ainda outras, chegando a água a invadir os segundos e terceiros andares das casas. Em muitas ruas da cidade os barcos navegavam para a custo salvarem muitas famílias que imploravam misericórdia dos últimos andares e telhados. Por toda a parte se ouviam gritos de terror. Um dos homens a quem mais se deveu a salvação de muitos infelizes inundados foi o cidadão Joaquim Dias de Almeida, mas houve muitos outros que se distinguiram, como nessa época fizeram menção o Imparcial e o Defensor, jornais do Funchal. As calçadas de Santa Clara, do Pico, Bela Vista e Incarnação foram convertidas em caudalosas ribeiras. O bairro do Cemitério dos Inglêses ficou despovoado, sendo todos os seus moradores acolhidos e agasalhados, com todos os confortos, por uma proprietária abastada, que residia no fim da rua da Bela Vista. Uma grande parte da cidade ficou destruída e as casas arruinadas até aos alicerces. Muitas famílias remediadas ficaram pobres. Foi um prejuízo de centenares de contos de reis. No dia 26, dois dias depois, o vento sul fez desencadear no porto do Funchal, uma medonha tempestade. As ondas embravecidas saltavam as muralhas da Pontinha e por vezes lamberam a esplanada do Ilhéu, vindo durante a tarde despedaçar-se nos rochedos da praia do Funchal, dez ou onze embarcações, sendo os tripulantes e guardas, que se achavam a bordo, salvos milagrosamente pelo guarda da alfândega Carvalho e por uns marítimos arrojadissimos, distinguindo-se sempre nestas catástrofes Joaquim Dias de Almeida. 17,18,19 e 20 de Novembro de 1848. Houve nestes dias grandes inundações, principalmente no concelho de Sant'Ana, sendo arrastadas pelas águas muitas bemfeitorias produtivas e importantes. No Funchal as águas das ribeiras correram com violência, mas, a pesar de copiosissimas, não produziram estragos sensíveis.\n\n## 5 e 6 de Janeiro de 18596.\nEm virtude de chuvas abundantissimas, trouxe a corrente da Ribeira de João Gomes muito entulho que sobrepujou os mainéis entre a foz e o Campo da Barca. Não podendo as águas correr livremente, foram inundar a R. de Santa Maria, as travessas que a cortam, a R. do Ribeirinho de Baixo e o largo do Pelourinho, fazendo em todos estes pontos grandes destroços. A Ribeira de Santa Luzia não causou prejuízos, embora ficasse também entulhada, mas a de S. João fez não pequenos estragos, principalmente nas proximidades da capela. Na Ribeira Brava, na Tabua, na Serra de Água, na Ponta do Sol, no Paul do Mar e noutras localidades houve também grandes devastações produzida pelas águas.\n1 de Janeiro de 1876. As inundações deste dia só causaram prejuízos notáveis na freguesia da Madalena.\n2 e 3 de Outubro de 1895. A aluvião que se deu nestes dois dias produziu grandes estragos nas freguesias de S. Vicente, Faial, Ponta Delgada, Boa Ventura e Seixal. Nesta ultima freguesia morreu o proprietário Manoel Inisio da Costa Lira. As ribeiras do Funchal trouxeram muita água.\n## 8 e 9 de Novembro de 1901.\nAs chuvas abundantissimas que nestes dois dias caíram no Funchal, inundaram as ruas e caminhos, danificaram muitos destes e provocaram alguns desmoronamentos, principalmente na Levada de Santa Luzia.\n## 25 e 26 de Fevereiro de 1920.\nNestes dois dias fez sentir um violento temporal de vento e chuva que causou inúmeros prejuízos em toda a ilha. As ribeiras que atravessam a cidade, embora trouxessem muita água, não chegaram a trasbordar, mas houve inundações em vários sítios, devido á abundância das chuvas e aos ribeiros da Nora, do Til e dos Louros terem ficado obstruidos. No bairro de Santa Maria chegaram a andar barcos nas ruas para conduzir pessoas de uns para outros pontos, e diz-se que e toda a ilha ficaram mais de 500 pessoas sem abrigo, sendo incalculaveis os destroços causados pelo vento N. W. no arvoredo, nos canaviais e em muitas outras culturas. No caminho do Lazareto morreu um indivíduo que se dirigia de noite para sua casa e no molhe da Pontinha morreu um outro que trabalhava no Cabrestante, sendo tal a impetuosidade do vento no dia 25 e parte do dia 26, que era perigoso transitar mesmo nas ruas da cidade. No dia 25, de tarde, foi suspenso, por causa do vento, o serviço de automóveis no Funchal.\nA vila da Ribeira Brava correu grande risco de ser destruída pelas águas, tendo saído a imagem de S. Bento em procissão e havendo depois preces na igreja paroquial. Em Machico, Santa Cruz, S. Vicente e Camacha registaram-se importantíssimos prejuízos, morrendo uma mulher e uma criança nesta ultima freguesia. Desapareceram, com os respectivos tripulantes, alguns barcos de pesca de Câmara de Lobos, e o barco Arriaga, do Porto Santo, que conduzia 16 passageiros, foi impelido para o sul pelo temporal, sendo encontrado pelo vapor inglês Andorinha, que tomou os passageiros, arribando o barco ás Selvagens.\nNo dia 28 voltou a chover torrencialmente e no dia 2 de Março soprou de novo com grande violência o vento N. W., havendo também fortes aguaceiros, que duraram até á madrugada do dia 3.\n## 5 e 6 de Março de 1921.\nCaíram nestes dias abundantes chuvas, acompanhadas de trovoada, em toda a ilha, havendo inundações e estragos em Machico, Ribeira Brava, etc., etc.. Em Machico as águas subiram nalguns pontos quasi ao primeiro andar das casas, e na Ribeira Brava morreram quatro crianças, sendo três em virtude do desmoronamento dum prédio e uma arrastada pelas águas.\nAlém das doze aluviões que ficam mencionadas, colhemos noticia, num antigo manuscrito, que no ano de 1611 houve uma grande enchente no Funchal, que, entre os notáveis estragos que causou, se conta o de ter destruíd em grande parte a igreja paroquial da freguesia de Santa Maria Maior que então ficava na rua que hoje tem o nome de Hospital Velho. Procedeu-se depois á construção duma nova igreja nas imediações do atual fontanário chamado do Calhau, e que foi arrastada para o mar pela aluvião de 1803. Também temos noticia doutra aluvião que se deu no ano de 1707 e que causou consideráveis prejuízos em toda a ilha.",
    "categories": [
        "geography",
        "history"
    ],
    "freguesias": [
        "Paul do Mar",
        "Camacha",
        "Faial",
        "Santa Maria Maior",
        "Madalena",
        "Ponta Delgada",
        "Santa Cruz",
        "Ribeira Brava",
        "Boa Ventura",
        "Funchal",
        "Machico",
        "Seixal",
        "Porto Santo",
        "Serra de Água",
        "Selvagens",
        "Câmara de Lobos",
        "Ponta do Sol",
        "S. Vicente"
    ],
    "locations": {
        "Funchal": [
            "Capital da Madeira"
        ],
        "Machico": [
            "Vila de Machico"
        ]
    },
    "people": {
        "D. José Manuel da Câmara": [
            "Governador e capitão general"
        ],
        "Reinaldo Oudinot": [
            "Brigadeiro encarregado de dirigir os trabalhos de encanamento das ribeiras"
        ],
        "D. João": [
            "Príncipe Regente"
        ],
        "Joaquim Dias de Almeida": [
            "Salvador de muitos infelizes inundados"
        ],
        "Manoel Inisio da Costa Lira": [
            "Proprietário"
        ],
        "S. Bento": [
            "Imagem"
        ],
        "Andorinha": [
            "Vapor inglês"
        ]
    },
    "years": {
        "1724": [
            "Estragos principalmente em Machico, com 26 mortes e mais de 80 habitações destruídas. Destruição também em Santa Cruz e Funchal. Enchente da Ribeira do Pinheiro (Santa Luzia) que a divide."
        ],
        "1765": [
            "Grandes chuvas causaram destruição da Ponte da Praça e outras pontes da cidade do Funchal. Inglês Moita arrastado para o mar pela Ribeira da Praça ou de João Gomes."
        ],
        "1803": [
            "Inundação na Madeira",
            "Grande aluvião"
        ],
        "1804": [
            "Brigadeiro Reinaldo Oudinot chegou à Madeira para dirigir os trabalhos de encanamento das ribeiras"
        ],
        "1807": [
            "Morte de Reinaldo Oudinot"
        ],
        "1815": [
            "Inundação de 26 de Outubro"
        ],
        "1842": [
            "Inundação de 28 de Outubro"
        ],
        "1848": [
            "Grandes inundações"
        ],
        "18596": [
            "Chuvas abundantissimas"
        ],
        "1876": [
            "Inundações"
        ],
        "1895": [
            "Aluvião"
        ],
        "1901": [
            "Chuvas abundantissimas"
        ],
        "1920": [
            "Temporal de vento e chuva"
        ],
        "1921": [
            "Chuvas abundantes"
        ]
    }
}