{
    "id": 1978,
    "lang": "pt",
    "is_original": true,
    "title": "Leuchtenberg (Duque de)",
    "fl": "L",
    "original_title": "Leuchtenberg (Duque de)",
    "body": "No dia 23 de Agosto de 1849, ancorou no nosso porto a fragata da marinha russa Kamtchatka, conduzindo a seu bordo o príncipe Maximiliano, duque de Leuchtenberg, irmão do príncipe Augusto, primeiro marido de D. Maria II, e de D. Amelia, viúva de D. Pedro IV. O navio ficara de quarentena e o príncipe só pode desembarcar no dia 27 de Agosto, tendo uma brilhante recepção preparada pelo então governador civil, o benemérito conselheiro José Silvestre Ribeiro.\n\nPercorreu o príncipe muitas freguesias da Madeira e visitou também o Porto Santo, sendo um entusiástico admirador das belezas naturais do nosso arquipélago. Demorou-se nesta ilha até o dia 23 de Abril de 1850, em que embarcou em direcção á Russia. Deixou entre nós as mais gratas recordações, não só pela extrema lhaneza do seu trato como pelos sentimentos de caridade de que deu eloquentes provas em favor dos pobres da nossa terra.\n\nO duque de Leuchtenberg, que era filho do célebre príncipe Eugenio Napoleão e genro do imperador da Rússia Nicolau I, viera á Madeira em procura de alívios aos seus padecimentos e, ao ausentar-se, declarou, no meio de convulsivo choro, que aqui passara alguns dos dias mais felizes e mais tranquilos de toda a sua vida.\n\nA sua comitiva compunha-se do Príncipe Pierre Bagratin, conde de Ojarowski, capitão Pauchine, o secretário Eugène Mussar, o médico Dr. S. Fischer e quinze criados.\n\nResidiu na quinta das Angústias, onde anteriormente também residira a rainha Adelaide de Inglaterra, e onde morreu em 1853 a princesa D. Maria Amelia. Visitou o Porto Santo no ano de 1850, indo aquela ilha na fragata russa Palas.\n\nUm filho do príncipe Maximiliano, o príncipe Nicolau Maximiliano, também duque de Leuchtenberg, visitou a Madeira em 1886, tendo chegado ao porto do Funchal a 1 de Dezembro e desembarcado no dia imediato. Foram-lhe prestadas as honras militares a que tinha direito, na qualidade de príncipe aparentado com as casas reais de Portugal e da Rússia.\n\nO príncipe Nicolau passou uma parte do ano de 1887 na Madeira, retirando para a Europa a 16 de Junho.",
    "categories": [
        "history"
    ],
    "freguesias": [
        "Santa Maria Maior"
    ],
    "locations": {
        "Porto Santo": [
            "Ilha"
        ]
    },
    "people": {
        "Maximiliano": [
            "Príncipe"
        ],
        "Augusto": [
            "Príncipe"
        ],
        "Maria II": [
            "Rainha"
        ],
        "Amelia": [
            "Rainha"
        ],
        "Pedro IV": [
            "Rei"
        ],
        "Eugenio Napoleão": [
            "Príncipe"
        ],
        "Nicolau I": [
            "Imperador"
        ],
        "Pierre Bagratin": [
            "Príncipe"
        ],
        "Ojarowski": [
            "Conde"
        ],
        "Pauchine": [
            "Capitão"
        ],
        "Eugène Mussar": [
            "Secretário"
        ],
        "Dr. S. Fischer": [
            "Médico"
        ],
        "Adelaide de Inglaterra": [
            "Rainha"
        ],
        "Maria Amelia": [
            "Princesa"
        ],
        "Nicolau Maximiliano": [
            "Príncipe"
        ]
    },
    "years": {}
}