{
    "id": 3132,
    "lang": "pt",
    "is_original": true,
    "title": "Roseira",
    "fl": "R",
    "original_title": "Roseira",
    "body": "A única que é espontânea na Madeira é a Rosa canina, mas nos jardins existem outras espécies de roseiras, algumas delas verdadeiramente notáveis pelo tamanho e colorido das suas flores. A Rosa gallica, a Rosa indica e a Rosa damascena são as espécies mais cultivadas no Funchal, mas afora estas encontram-se muitas outras nos jardins, tais como a Rosa moschata, a Rosa Banksiae, a Rosa centifolia, a Rosa alba, etc., etc.. Nos bardos em S. Martinho e Santo Antonio é frequente a Rosa multiflora, espécie aparentemente naturalizada e que não requere cuidados alguns da parte do homem. O óleo essencial de rosas é extraído das pétalas da Rosa centifolia, e as pétalas da Rosa gallica constituem a base da conserva de rosas, medicamento que se administra com vantagem na diarreia e na tuberculose. As roseiras remontantes, ou de floração continua, são frequentes na Madeira.",
    "categories": [
        "biology"
    ],
    "freguesias": [
        "S. Martinho",
        "Santo Antonio"
    ],
    "locations": {
        "Funchal": [
            "Mais cultivadas no Funchal"
        ],
        "S. Martinho": [
            "Nos bardos em S. Martinho"
        ],
        "Santo Antonio": [
            "Nos bardos em Santo Antonio"
        ]
    },
    "people": {},
    "years": {}
}