{
    "id": 3194,
    "lang": "pt",
    "is_original": true,
    "title": "Santa Maria Maior (Freguesia de)",
    "fl": "S",
    "original_title": "Santa Maria Maior (Freguesia de)",
    "body": "No lado oriental da cidade do Funchal e constituindo uma das suas quatro freguesias, fica situada a freguesia de Santa Maria Maior. Provém-lhe esta denominação da circunstância de ter a sua primitiva igreja paroquial mais amplas proporções do que a capela edificada por João Gonçalves Zarco no local onde hoje se levanta a igreja de Santa Clara, sendo ambas consagradas a Nossa Senhora da Conceição. Também foi em outros tempos conhecida pelo nome de Conceição de Baixo e a outra por Conceição de Cima, tendo-se-lhe igualmente chamado Nossa Senhora do Calhau, por estar construída não muito longe da praia, sendo este nome que mais perdurou entre o povo e que ainda hoje conserva. Tornou-se esta paróquia muito conhecida, e ainda presentemente o é, pelo nome de freguesia do Socorro, sendo esta denominação aplicada de modo especial á parte dela compreendida entre a igreja paroquial e a margem esquerda da ribeira de João Gomes. Teve este nome origem na imagem de Nossa Senhora do Socorro, que se venerava na igreja paroquial e que em outros tempos era objecto de fervoroso culto por parte dos habitantes do Funchal. Da igreja de Nossa Senhora do Calhau, já demos noticia em outro lugar (volume II, página 451), e da igreja de S. Tiago, para onde foi transferida a sede da freguesia no ano de 1803, nos ocuparemos na altura competente desta obra. Acerca da criação desta paróquia, dissemos o suficiente no artigo Freguesias (volume II, página 52) e para lá remetemos o leitor, podendo afirmar-se que foi esta a primeira e é ao presente a mais antiga freguesia deste arquipélago. Com a construção do magnífico templo da Sé Catedral, foi a sede da paróquia de Santa Maria Maior transferida para a nova e ampla igreja, pelos anos de 1508. Aproximadamente cinquenta anos depois, com o aumento sempre crescente da população foi a freguesia, pelo alvará régio de 18 de Novembro de 1557, dividida em duas paróquias autónomas, sendo as suas respectivas sedes na Sé Catedral e na igreja de Nossa Senhora do Calhau. Depois dos religiosos franciscanos, parece que foi Nuno Cão (V. este nome) um dos primeiros sacerdotes que exerceram funções paroquiais nesta freguesia, passando em 1508 para a Sé Catedral e sendo em 1514 elevado a deão da mesma Sé. Dividida a paróquia em 1537, foi primeiro vigário de Santa Maria Maior o licenciado Antonio Mourão, ao qual se estabeleceu, pelo alvará de 23 de Fevereiro de 1558 a congrua anual de 20:000 réis, uma pipa de vinho e dois moios de trigo. O curato, desta freguesia foi criado por alvará régio de 27 de Agosto de 1589, com o vencimento anual de 20.000 réis. Teve esta igreja uma colegiada, criada pelo alvará de 18 de Novembro de 1557, composta, além do vigário e cura, de mais três beneficiados, que depois foram elevados ao numero de seis, e de um tesoureiro, pregador e organista. Esta paróquia tem as capelas do Corpo Santo, Nossa Senhora do Bom Sucesso, Nossa Senhora do Faial, Nossa Senhora Mãe dos Homens e outras que já desapareceram, de todas as quais daremos sucinta noticia. Na área desta freguesia, ficam o antigo campo de D. Carlos, hoje do Almirante Reis, a fortaleza de São Tiago, o Campo da Barca ou de Miguel Bombarda, o Posto de Desinfecção Terrestre, a fabrica da luz eléctrica e outros estabelecimentos industriais. Tem a freguesia de Santa Maria Maior a população de 7823 habitantes (1921) e principia na Ribeira de João Gomes, sendo uso dar-lhe como limites, da parte do nascente, a metade ocidental ou esquerda dos caminhos do Palheiro e do Terça, pertencendo a metade oriental ou direita, á freguesia de S. Gonçalo. Convém advertir, porém, que tais limites não concordam com os que se acham assinalados no Mappa Alphabetico das ruas da cidade, aprovado pelo Governador Civil em 15 de Dezembro de 1863, no qual claramente se declara que toda a rua do Palheiro, desde a Quinta do Acciaioly ou do Faial até a rua Bela de S. Tiago, pertence à freguesia de Santa Maria Maior, e que esta paróquia se estende até o sítio dos Louros, ficando todavia a travessa da Olaria, hoje do Lazareto, na freguesia de S. Gonçalo. Segundo o mesmo Mappa, o espaço compreendido entre a Rua Bela de S. Tiago e o prédio de Tomás Teodoro, na Calçada do Socorro, pertence do lado norte a Santa Maria Maior e do lado sul a São Gonçalo, devendo considerar-se, portanto, como fazendo parte desta ultima freguesia a parte sul do largo da Forca e do caminho do Lazareto até ao ponto em que começa o sítio dos Louros\n\n> Vid. Limites da cidade, Freguesias, Nossa Senhora do Calhau, Academica (Praça), Cão (Nuno), Ordem de Cristo, Carlos (Campo de D.) e Posto de Desinfeccão.",
    "categories": [
        "geography"
    ],
    "freguesias": [
        "Santa Maria Maior",
        "Posto de Desinfeccão",
        "Carlos (Campo de D.)",
        "Ordem de Cristo",
        "Academica (Praça)",
        "Nossa Senhora do Calhau",
        "Cão (Nuno)",
        "S. Gonçalo"
    ],
    "locations": {
        "Funchal": [
            "Cidade"
        ],
        "Ribeira de João Gomes": [
            "Margem esquerda"
        ]
    },
    "people": {
        "João Gonçalves Zarco": [
            "Edificou a capela"
        ],
        "Nuno Cão": [
            "Um dos primeiros sacerdotes que exerceram funções paroquiais nesta freguesia"
        ],
        "Antonio Mourão": [
            "Primeiro vigário de Santa Maria Maior"
        ]
    },
    "years": {
        "1508": [
            "Transferida a sede da freguesia para a nova e ampla igreja"
        ],
        "1557": [
            "Dividida em duas paróquias autónomas"
        ],
        "1589": [
            "Criado o curato desta freguesia"
        ]
    }
}