{
    "id": 323,
    "lang": "pt",
    "is_original": true,
    "title": "Atouguia",
    "fl": "A",
    "original_title": "Atouguia",
    "body": "Luiz de Atougia foi dos primitivos povoadores desta ilha e talvez o primeiro que entre nós usou este apelido. Era natural de Beja e filho de Luiz Afonso de Atouguia e de D. Isabel Telo. Exerceu na Madeira o cargo de tesoureiro de D. Manuel, quando duque de Beja e grão-mestre de Ordem de Cristo. Este Luiz de Atouguia ou um seu próximo descendente teve terras de sesmaria na freguesia da Calheta, no sítio onde ainda hoje chamam o Lombo do Atouguia, a que deu o nome. Armas: “Em campo vermelho esquartelado com uma cruz de ouro formada do campo, e em cada quarto uma flor de lis de ouro; orla do mesmo, timbre um leão nascente de ouro”.",
    "categories": [
        "history"
    ],
    "freguesias": [
        "Calheta"
    ],
    "locations": {
        "Beja": [
            "Natural de"
        ],
        "Madeira": [
            "Cargo de tesoureiro"
        ],
        "Calheta": [
            "Freguesia"
        ]
    },
    "people": {
        "Luiz de Atougia": [
            "Primitivos povoadores"
        ]
    },
    "years": {}
}