{
    "id": 3436,
    "lang": "pt",
    "is_original": true,
    "title": "Távora (D. Fernando de)",
    "fl": "T",
    "original_title": "Távora (D. Fernando de)",
    "body": "Foi o 5.° bispo desta diocese tendo sido confirmado pelo papa Pio V no consistório de 14 de Novembro de 1570.\n\nEra natural de Santarém e filho de Fernão Cardoso e de D. Filipa de Brito, que pertenciam às mais nobres e distintas famílias daquela vila.\n\nDepois de se ter doutorado em teologia na Universidade de Coimbra, entrou na ordem de S. Domingos e nela exerceu cargos importantes. Foi afamado orador na sua época e gozou dos créditos de homem de raro talento e de vasta erudição. Escreveu um livro de comentários ao evangelho de S. João e outras obras, que ficaram Inéditas.\n\nTeve a particular estima do rei D. Sebastião, que em 1569 o nomeou prelado desta diocese1 lugar que exerceu por meio dos seus vigários gerais, não vindo à Madeira gelo medo que lhe inspirava a travessia do oceano. Não temos conhecimento de qualquer facto digno de menção que houvesse assinalado a sua administração episcopal entre nós.\n\nReconhecendo a impossibilidade de assumir pessoalmente a direcção do seu bispado, renunciou à mitra em 1573, sendo então nomeado esmoler do rei D. Sebastião.\n\nMorreu em 1577 e foi sepultado no convento de S. Domingos em Lisboa.\n\n## (D. Lourenço de).\n\nEste prelado funchalense deixou nas crónicas eclesiásticas deste bispado memória honrada da",
    "categories": [
        "history",
        "religion"
    ],
    "freguesias": [],
    "locations": {},
    "people": {
        "D. Fernando de Távora": [
            "5.° bispo desta diocese"
        ],
        "D. Sebastião": [
            "Rei"
        ]
    },
    "years": {
        "1570": [
            "Confirmado pelo papa Pio V no consistório"
        ],
        "1569": [
            "Nomeou prelado desta diocese"
        ],
        "1573": [
            "Renunciou à mitra"
        ],
        "1577": [
            "Morreu"
        ]
    }
}