{
    "id": 540,
    "lang": "pt",
    "is_original": true,
    "title": "Borges (Gaspar)",
    "fl": "B",
    "original_title": "Borges (Gaspar)",
    "body": "As Saudades da Terra consagram oito longas paginas a um tal Gaspar Borges, que depois do saque dos piratas franceses desencravou as peças de artilharia, que foram julgadas completamente inutilizadas e que ele com grande admiração de todos conseguiu restituir ao seu primitivo uso. Pelos detalhes a que desce Frutuoso e pelos louvores com que enaltece o trabalho de Gaspar Borges, deverá realmente ser ele um habilissimo mecânico e de uma competência fora do vulgar, a pesar do que possa haver de hiperbólico na narrativa do cronista. A nós causa nos uma grande estranheza que Gaspar Frutuoso levasse tão longe a pormenorização do caso e se tornasse um tão entusiástico panegirista do desencravado daquelas peças! (quem quiser tomar conhecimento circunstanciado da estranha habilidade do famigerado Borges, leia as Saudades a pagina 283 e seguintes. Marceliano Ribeiro de Mendonça publicou um interessante romance histórico intitulado Gaspar Borges, em que figura como principal protagonista o hábil artífice, a quem as Saudades tão largamente se referem.\n\nBorges (Vasco). Foi nomeado governador civil da Madeira por decreto de 4 de Abril de 1914 e tomou posse deste cargo a 27 dos ditos mês e ano.\n\nBornmuller (P.). Botânico alemão que herborizou na Madeira em 1900. E.: Ergebnisse zweier botanischer Reisen nach Madeira und den Canarischen Inseln (Bot. Jahrb., 1903).",
    "categories": [
        "history"
    ],
    "freguesias": [],
    "locations": {},
    "people": {
        "Gaspar Borges": [
            "Habilissimo mecânico e de uma competência fora do vulgar"
        ],
        "Vasco Borges": [
            "Governador civil da Madeira"
        ],
        "Marceliano Ribeiro de Mendonça": [
            "Publicou um interessante romance histórico intitulado Gaspar Borges"
        ],
        "Bornmuller (P.)": [
            "Botânico alemão que herborizou na Madeira em 1900"
        ]
    },
    "years": {
        "1914": [
            "Foi nomeado governador civil da Madeira"
        ],
        "1900": [
            "Herborizou na Madeira"
        ],
        "1903": [
            "Ergebnisse zweier botanischer Reisen nach Madeira und den Canarischen Inseln"
        ]
    }
}