{
    "id": 618,
    "lang": "pt",
    "is_original": true,
    "title": "Cabral",
    "fl": "C",
    "original_title": "Cabral",
    "body": "Um dos quatro fidalgos que D. Afonso mandou para a Madeira a fim de casarem com as filhas do descobridor foi Diogo Cabral, que era filho de Fernão Alvares Cabral, guarda-mor do infante D. Henrique. Foi um dos primeiros povoadores desta Ilha e aqui casou com Brites Gonçalves da Câmara, segunda filha de João Gonçalves Zarco. Diogo Cabral fez edificar a capela de Nossa Senhora da Estrela na Calheta, que fora traçada por Zarco, e cuja construção ele muito recomendara a seus filhos. Cabral teve ali muitas terras de sesmaria, que lhe foram doadas por seu sogro. Morreu a 15 de Dezembro de 1486, e jaz sepultado na capela por ele construída. Era avô de Tristão Vaz da Veiga. Foi o primeiro que nesta ilha usou o apelido de Cabral.\n\nArmas dos Cabrais: duas cabras passantes ornadas de púrpura e preto: timbre uma das cabras do escudo.",
    "categories": [
        "history"
    ],
    "freguesias": [
        "Calheta"
    ],
    "locations": {
        "Calheta": [
            "Fez edificar a capela de Nossa Senhora da Estrela"
        ]
    },
    "people": {
        "Diogo Cabral": [
            "Um dos primeiros povoadores desta Ilha"
        ]
    },
    "years": {
        "1486": [
            "Morreu"
        ]
    }
}