{
    "id": 174,
    "lang": "de",
    "is_original": false,
    "title": "Überschwemmungen",
    "fl": "Ü",
    "original_title": "Aluviões",
    "body": "In der unten veröffentlichten Liste sind alle Überschwemmungen aufgeführt, die es auf Madeira gegeben hat und über die wir einige Informationen erhalten konnten. Es sollte jedoch beachtet werden, dass die Überschwemmung von 1724 nicht die erste war, die Schäden verursachte, denn Mouquet, der 1601 hier war, sagt, obwohl er keine genauen Daten angibt, „dass die Wasser, die von den Bergen herabfließen, manchmal Brücken und Häuser auf der ganzen Insel zerstören“.\n\n## 18. November 1724.\n\nDie Schäden dieser Überschwemmung waren vor allem in der Gemeinde Machico zu spüren, wo 26 Menschen starben und mehr als 80 Wohnungen zerstört wurden. Im 'Anno Histórico' bezieht sich Pater Francisco de Santa Maria auf die Überschwemmung von 1724 und sagt, dass „die Insel Madeira einen so großen Sturm und eine Flut erlitt, dass sie die Stadt Machico, Teile der Stadt Santa Cruz und viele andere Orte und Gebiete der gleichen Insel zerstörte, und auch die Stadt Funchal erlitt großen Schaden und viele Ruinen, sowohl in ihren Mauern als auch in der Bevölkerung, mit dem Hochwasser des Ribeira do Pinheiro (Santa Luzia), das sie teilt“\n\n## 18. November 1765.\n\nAufgrund der starken Regenfälle stiegen an diesem Tag die Bäche, die durch Funchal fließen, stark an, wobei die Brücke am Platz zerstört und andere Brücken der Stadt stark beschädigt wurden. Die Wassermassen des Ribeira da Praça oder João Gomes rissen den Engländer Moita (?) ins Meer, der nie wieder auftauchte.\n\n## 9. Oktober 1803.\nDieser Tag war traurig denkwürdig, als eine große Flut die Felder Madeiras überflutete und einen beträchtlichen Teil der Stadt zerstörte, was nicht nur enorme materielle Schäden, sondern auch den Verlust von einigen hundert Menschenleben verursachte. Zweifellos kann dies als die größte Katastrophe angesehen werden, die diese Insel in einem langen Zeitraum von fünf Jahrhunderten heimgesucht hat. Wir würden weit gehen, wenn wir eine detaillierte Beschreibung dieser schrecklichen Katastrophe geben wollten, und deshalb beschränken wir uns darauf, einige kurze Notizen zu skizzieren, die schnell aus den Chroniken der Zeit gesammelt wurden.\n\nIn den zehn oder zwölf Tagen vor dem 9. Oktober 1803 hatte es einige Regenfälle mit verschiedenen Unterbrechungen gegeben. An diesem Tag begann es um 8 Uhr morgens in Funchal zu regnen, nicht sehr stark, was unverändert bis 20 Uhr abends anhielt, aber nichts ließ befürchten, dass eine so schreckliche Flut bevorstand. Dann begann man das Donnergrollen zu hören und der Regen, begleitet von etwas Wind, fiel bereits in wahren Sturzbächen. Um 20:30 Uhr überschritten die Wassermassen der Bäche ihre Ufer und breiteten sich mit großem Lärm durch die Seitenstraßen aus, begannen ihre Zerstörungs- und Todesarbeit. Es war mitten in der Sintflut.\n\nUnbeschreiblich ist der Schrecken, der sich der Einwohner bemächtigte, der noch größer wurde durch das unerwartete Ereignis, das viele überraschte und ohne Möglichkeit ließ, sich vor der Gefahr, die alle bedrohte, in Sicherheit zu bringen. Der Tod überraschte viele auf der Flucht, mitgerissen von der Gewalt der Strömungen oder getroffen von den Einstürzen der Häuser und Wände, die zusammenbrachen.\n\nDas Viertel Santa Maria Maior war am stärksten von dem Sturm betroffen. Der Ribeira de João Gomes platzte an drei verschiedenen Punkten aufgrund der Fülle und Gewalt des Wassers, wodurch drei heftige Strömungen entstanden, die die größten Schäden verursachten und einige Dutzend Menschen töteten. Ganze Straßen und zahlreiche Wohnhäuser und andere Gebäude wurden ins Meer gespült, einschließlich der Pfarrkirche, bekannt unter dem Namen Nossa Senhora do Calhau, die am linken Ufer des Baches lag, zwischen der heutigen Rua de Santa Maria und Rua Nova de Santa Maria. In einem Haus dieser Straße wurden 21 Personen verschüttet und in einem Gebäude am Pelourinho starben ein englischer Staatsangehöriger und 15 Familienmitglieder. Es wird geschätzt, dass allein im Viertel Santa Maria Maior etwa 200 Menschen während der Überschwemmung ums Leben kamen.\n\nDie Gebäude entlang des Ribeira de Santa Luzia wurden ebenfalls stark beschädigt. Oberhalb der Brücke Bom Jesus nahmen die Wassermassen einen neuen Kurs entlang beider Ufer des Baches und verursachten vor allem in der Rua dos Ferreiros erhebliche Schäden, wobei mehrere Wohnhäuser und Geschäfte einstürzten. Das Gleiche geschah in der Rua dos Tanoeiros und an verschiedenen Gebäuden, die am linken Ufer des Baches lagen und die Rua Direita bildeten, Gebäude, die von der Gewalt des Stroms mitgerissen wurden.\n\nEin zeitgenössischer Bericht über das Ereignis sagt:\n\n\"Ganze Straßen verschwanden mit ihren Bewohnern und andere, überschwemmt von Wasser und Schlamm, ließen die Eigentümer und Mieter in äußerster Not zurück. Ein großer Teil der Gemeinde Santa Maria Maior, sowie ihre Kirche, die älteste der Stadt, existieren nicht mehr mit einem guten Teil ihrer unglücklichen Bewohner: der Rest, hier und da verstreut, überschwemmt und verlassen, bietet dem mitfühlenden Menschen einen Anblick von Schmerz, Zerstörung und Bestürzung. Die Straßen namens Direita, Tanoeiros, Valverde, Santa Maria, Hospital Velho und andere wurden mit einer unglaublichen Menge von Bewohnern ins Meer gespült.\"\n\nAußerhalb von Funchal waren die Ortschaften, die am meisten unter der schrecklichen Überschwemmung litten, Machico, Santa Cruz, Campanário, Ribeira Brava und Calheta, wobei die Schäden in den nördlichen Gemeinden der Insel relativ gering waren.\n\nIn Bezug auf das Dorf Machico liest man Folgendes im Archiv der dortigen Pfarrkirche: „...es riss die Mauer des Flusses nieder, zerstörte die Brücke und überflutete das Dorf so sehr, dass das Wasser in der Kirche und auf allen Straßen eine Höhe von drei Ellen erreichte. Diese Flut versprach allen den Tod; aber ein offensichtliches Wunder bewirkte, dass alle gerettet wurden, außer vierzehn Personen, die von den Wassern mitgerissen und in den Häusern verschüttet wurden.“ Es zerstörte auch die alte und historische Kapelle des Herrn der Wunder, deren Bild einige Tage später auf hoher See von einem amerikanischen Schiff gefunden und in die Kathedrale von Funchal gebracht wurde.\n\nEbenso erheblich waren die Schäden, die die Überschwemmung in den anderen genannten Gemeinden anrichtete, wo ebenfalls viele Leben verloren gingen.\n\nDie zeitgenössischen Informationen über die Ereignisse sind sehr unterschiedlich, was die Anzahl der Menschen betrifft, die den Fluten zum Opfer fielen. Ein Bericht über den schrecklichen Vorfall schätzt die Zahl der Toten und Vermissten auf etwa tausend. Es scheint nicht weit von der Wahrheit entfernt zu sein, die Zahl der Todesopfer auf etwa sechshundert zu schätzen, wobei die meisten im Bezirk Funchal umkamen.\n\nZu dieser Zeit war D. José Manuel da Câmara Gouverneur und Kapitän-General, der unverzüglich eine Bekanntmachung veröffentlichte und sofortige und geeignete Maßnahmen ergriff, die die Umstände des Augenblicks erforderten. Die erste Sorge der Behörden war es, Unterkunft für diejenigen zu finden, die ihr Zuhause verloren hatten und deren Zahl sehr groß war. Öffentliche Gebäude, verschiedene staatliche Dienststellen, viele Kirchenanbauten, Kasernen und Festungen sowie zahlreiche Privathäuser wurden als vorübergehende Unterkünfte für diese Personen bereitgestellt. Unter den Maßnahmen des Gouverneurs ist das absolute Verbot der Preiserhöhung für Verbrauchsgüter hervorzuheben, bei Strafe schwerer Bestrafung für die Übertreter.\n\nDie Hauptursache für die durch die Überschwemmung verursachten Schäden war das Fehlen von Kanalisationsanlagen für die Flüsse. Obwohl verspätet, beschloss die Regierung des Mutterlandes, diese so erwünschte Verbesserung umzusetzen und sandte den Brigadegeneral Reinaldo Oudinot nach Madeira, um die entsprechenden Arbeiten zu leiten, der am 19. Februar 1804 hier ankam. Er zeigte größte Kompetenz in der Ausführung seiner Aufgaben und entwickelte eine erstaunliche Aktivität, indem er in relativ kurzer Zeit die Kanalisierung der drei Flüsse, die durch Funchal fließen, bewerkstelligte. Im Dezember 1800 teilte er der Zentralregierung mit, dass trotz der großen Stürme und starken Winterregen, die kurz zuvor stattgefunden hatten, die Mauern dem heftigen Anprall der Wassermassen standgehalten und einen offensichtlichen Beweis für die Festigkeit ihrer Konstruktion geliefert hatten. Oudinot starb in dieser Stadt am 11. Februar 1807 und zu Ehren seiner Dienste wurde sein Name der Straße gegeben, die am linken Ufer des Flusses João Gomes liegt, zwischen dem Campo da Barca und dem Platz der Landarbeiter.\n\nEin interessantes Detail: Da das Hauptkapellengebäude der Kirche Nossa Senhora do Calhau stehen geblieben war, ordnete die königliche Verfügung vom 12. März 1805 an, dass es im selben Zustand erhalten bleiben sollte, in dem es von der Überschwemmung hinterlassen wurde, als Erinnerung für die Nachwelt an das Ereignis, das für die Bewohner dieser Insel am verheerendsten war. Im Dezember 1835 wurde ein Teil der Kirche, den die Überschwemmung verschont hatte, abgerissen und dort wurde der Markt União errichtet, der vor kurzem abgerissen wurde, um die Straße zu erweitern, die dort verläuft.\n\n##26. Oktober 1815\nNach der großen Überschwemmung vom 9. Oktober 1803 war dies vielleicht die größte, die diese Insel heimgesucht hat. In einer Darstellung, die die Stadtverwaltung von Funchal an den Prinzregenten Dom João wegen der Schäden durch diese Flut vom 26. Oktober 1815 richtete, wird behauptet, dass diese *unvergleichlich größer als die Überschwemmung von 1803+ war, aber weder in der Anzahl der Opfer noch in den verursachten Schäden erreichte sie die Ausmaße der anderen, trotz der enormen Verluste, die sie den Einwohnern von Funchal zufügte.\n\nWie bei anderen Gelegenheiten waren es die stürmischen Ströme der Bäche, die den größten Schaden verursachten. Insbesondere an einigen Stellen der Ufer der Bäche, die keine Mauern hatten, um sie zu stützen und den Lauf des Wassers zu lenken, traten diese aus ihrem Bett, überfluteten die angrenzenden Gebiete und bahnten sich einen neuen Weg durch Straßen und Häuser, was nicht nur unermessliche Zerstörungen verursachte, sondern auch größte Panik unter den Einwohnern auslöste, von denen einige Opfer der unzähmbaren Strömung wurden. Das geschah mit den Wassern des São João-Bachs, die auf der Suche nach einem neuen Weg etwa zwanzig Häuser von der São Paulo-Brücke am Ende der Carreira-Straße bis zur Mündung des Baches mitrissen.\n\nAuch an den Straßen entlang des Santa Luzia-Bachs waren die Schäden groß, einige Häuser wurden beschädigt und an einigen Stellen die Mauern des Baches.\n\nAuf der ganzen Insel gab es erhebliche Schäden und mehrere Menschen starben, mitgerissen von der Gewalt der Ströme.\n\nDie Schrecken der großen Überschwemmung von 1803, die noch in der Erinnerung aller lebendig waren, verstärkten die Panik unter den Einwohnern, die zum größten Teil glaubten, dass es keine Möglichkeit gab, dem Tod zu entkommen, der für sie unvermeidlich schien.\n\n## 28. Oktober 1842\nSeit fünfzehn Tagen fiel fast ununterbrochen ein leichter Tau. Um 9 Uhr morgens des 24. Oktobers waren die Regenfälle bereits reichlich, und um 15 Uhr nachmittags fielen die Niederschläge in Strömen. Die Wassermassen der Bäche traten aus ihren Betten und verbreiteten sich stürmisch über die angrenzenden Gebiete und verursachten große Schäden.\n\nDie Straßen des Stadtteils Santa Maria Maior, der Pelourinho, die Straße der Medinas und andere wurden vollständig überflutet, das Wasser drang in die zweiten und dritten Stockwerke der Häuser ein. In vielen Straßen der Stadt fuhren Boote, um mühsam viele Familien zu retten, die aus den obersten Stockwerken und Dächern um Gnade flehten. Überall waren Schreie des Terrors zu hören. Einer der Männer, dem die Rettung vieler unglücklicher Überschwemmungsopfer zu verdanken war, war der Bürger Joaquim Dias de Almeida, aber es gab viele andere, die sich auszeichneten, wie zu dieser Zeit die Zeitungen Imparcial und Defensor aus Funchal erwähnten. Die Straßen von Santa Clara, Pico, Bela Vista und Incarnação wurden in reißende Bäche verwandelt. Das Viertel des Englischen Friedhofs wurde entvölkert, und alle seine Bewohner wurden mit allen Annehmlichkeiten von einer wohlhabenden Eigentümerin aufgenommen und beherbergt, die am Ende der Bela Vista-Straße wohnte. Ein großer Teil der Stadt wurde zerstört und die Häuser bis zu den Fundamenten ruiniert. Viele wohlhabende Familien wurden arm. Es war ein Schaden von Hunderten von Millionen Reis. Am 26., zwei Tage später, entfesselte der Südwind im Hafen von Funchal einen schrecklichen Sturm. Die aufgebrachten Wellen übersprangen die Mauern der Pontinha und leckten manchmal die Esplanade des Ilhéu, und während des Nachmittags zerschellten an den Felsen des Strandes von Funchal zehn oder elf Schiffe, deren Besatzungen und Wachen, die sich an Bord befanden, wurden durch den Zollwächter Carvalho und einige wagemutige Seeleute, unter denen sich Joaquim Dias de Almeida immer bei diesen Katastrophen hervortat, wie durch ein Wunder gerettet. 17., 18., 19. und 20. November 1848. An diesen Tagen gab es große Überschwemmungen, insbesondere im Bezirk von Sant'Ana, wobei viele produktive und wichtige Wohltaten von den Wassern mitgerissen wurden. In Funchal flossen die Wassermassen der Bäche gewaltig, aber trotz ihrer Fülle verursachten sie keine spürbaren Schäden.\n\n##5. und 6. Januar 18596.\nAufgrund von überaus starken Regenfällen brachte der Strom der Ribeira de João Gomes viel Geröll mit sich, das die Mauern zwischen der Mündung und dem Campo da Barca überstieg. Da das Wasser nicht frei fließen konnte, überschwemmte es die R. de Santa Maria, die sie kreuzenden Gassen, die R. do Ribeirinho de Baixo und den Platz des Pelourinho, wobei an all diesen Orten große Zerstörungen angerichtet wurden. Die Ribeira de Santa Luzia verursachte keine Schäden, obwohl sie ebenfalls mit Geröll gefüllt war, aber die Ribeira de S. João richtete erhebliche Schäden an, insbesondere in der Nähe der Kapelle. In Ribeira Brava, Tabua, Serra de Água, Ponta do Sol, Paul do Mar und anderen Orten gab es ebenfalls große Verwüstungen durch die Wassermassen.\n1. Januar 1876. Die Überschwemmungen an diesem Tag verursachten nur in der Gemeinde Madalena nennenswerte Schäden.\n2. und 3. Oktober 1895. Die Überschwemmung, die sich an diesen beiden Tagen ereignete, verursachte große Schäden in den Gemeinden S. Vicente, Faial, Ponta Delgada, Boa Ventura und Seixal. In dieser letzten Gemeinde starb der Eigentümer Manoel Inisio da Costa Lira. Die Flüsse von Funchal führten viel Wasser.\n## 8. und 9. November 1901.\nDie überaus starken Regenfälle, die an diesen beiden Tagen in Funchal niedergingen, überschwemmten Straßen und Wege, beschädigten viele davon und verursachten einige Erdrutsche, insbesondere an der Levada de Santa Luzia.\n## 25. und 26. Februar 1920.\nAn diesen beiden Tagen wütete ein heftiger Sturm mit Wind und Regen, der auf der ganzen Insel unzählige Schäden anrichtete. Die Flüsse, die die Stadt durchqueren, obwohl sie viel Wasser führten, traten nicht über die Ufer, aber es gab Überschwemmungen an verschiedenen Stellen, aufgrund der Fülle des Regens und weil die Bäche der Nora, des Til und der Louros blockiert waren. Im Stadtteil Santa Maria wurden Boote auf den Straßen eingesetzt, um Menschen von einem Ort zum anderen zu bringen, und man sagt, dass auf der ganzen Insel mehr als 500 Menschen obdachlos wurden, wobei die durch den NW-Wind verursachten Zerstörungen an Bäumen, Zuckerrohrfeldern und vielen anderen Kulturen unermesslich waren. Auf dem Weg zum Lazarett starb eine Person, die nachts nach Hause ging, und am Kai der Pontinha starb eine weitere Person, die am Capstan arbeitete, wobei die Heftigkeit des Windes am 25. und teilweise am 26. so groß war, dass es selbst auf den Straßen der Stadt gefährlich war, sich zu bewegen. Am Nachmittag des 25. wurde der Automobilverkehr in Funchal wegen des Windes eingestellt.\nDie Stadt Ribeira Brava lief große Gefahr, durch die Wassermassen zerstört zu werden, wobei das Bildnis des Heiligen Benedikt in einer Prozession getragen wurde und anschließend Gebete in der Pfarrkirche stattfanden. In Machico, Santa Cruz, S. Vicente und Camacha wurden erhebliche Schäden verzeichnet, wobei in der letztgenannten Gemeinde eine Frau und ein Kind starben. Einige Fischerboote aus Câmara de Lobos verschwanden mit ihren Besatzungen, und das Boot Arriaga aus Porto Santo, das 16 Passagiere beförderte, wurde vom Sturm nach Süden getrieben und vom englischen Dampfer Andorinha gefunden, der die Passagiere aufnahm, während das Boot zu den Selvagens-Inseln trieb.\nAm 28. regnete es erneut in Strömen und am 2. März wehte der NW-Wind wieder mit großer Gewalt, begleitet von heftigen Regenschauern, die bis zum frühen Morgen des 3. März andauerten.\n## 5. und 6. März 1921.\nAn diesen Tagen fielen reichlich Regenfälle, begleitet von Gewittern, über die ganze Insel, wobei es zu Überschwemmungen und Schäden in Machico, Ribeira Brava usw. kam. In Machico stieg das Wasser an einigen Stellen fast bis zum ersten Stock der Häuser, und in Ribeira Brava starben vier Kinder, drei davon durch den Einsturz eines Gebäudes und eines wurde von den Wassermassen mitgerissen.\nNeben den zwölf erwähnten Überschwemmungen gibt es in einem alten Manuskript Hinweise darauf, dass es im Jahr 1611 eine große Flut in Funchal gab, die unter anderem die Pfarrkirche der Gemeinde Santa Maria Maior, die damals in der Straße lag, die heute den Namen Hospital Velho trägt, teilweise zerstörte. Danach wurde eine neue Kirche in der Nähe des heutigen Brunnens namens Calhau gebaut, die jedoch durch die Überschwemmung von 1803 ins Meer gerissen wurde. Es gibt auch Berichte über eine weitere Überschwemmung im Jahr 1707, die erhebliche Schäden auf der ganzen Insel verursachte.",
    "categories": [
        "geography",
        "history"
    ],
    "freguesias": [
        "Paul do Mar",
        "Camacha",
        "Faial",
        "Santa Maria Maior",
        "Madalena",
        "Ponta Delgada",
        "Santa Cruz",
        "Ribeira Brava",
        "Boa Ventura",
        "Funchal",
        "Machico",
        "Seixal",
        "Porto Santo",
        "Serra de Água",
        "Selvagens",
        "Câmara de Lobos",
        "Ponta do Sol",
        "S. Vicente"
    ],
    "locations": {
        "Funchal": [
            "Hauptstadt von Madeira"
        ],
        "Machico": [
            "Stadt Machico"
        ]
    },
    "people": {
        "D. José Manuel da Câmara": [
            "Gouverneur und Kapitän-General"
        ],
        "Reinaldo Oudinot": [
            "Brigadegeneral, beauftragt mit der Leitung der Arbeiten zur Kanalisierung der Flüsse"
        ],
        "D. João": [
            "Prinzregent"
        ],
        "Joaquim Dias de Almeida": [
            "Retter vieler unglücklicher Überschwemmungsopfer"
        ],
        "Manoel Inisio da Costa Lira": [
            "Eigentümer"
        ],
        "S. Bento": [
            "Statue"
        ],
        "Andorinha": [
            "Englisches Dampfschiff"
        ]
    },
    "years": {
        "1724": [
            "Schäden vor allem in Machico, mit 26 Todesfällen und mehr als 80 zerstörten Wohnstätten. Zerstörung auch in Santa Cruz und Funchal. Überschwemmung des Ribeira do Pinheiro (Santa Luzia), die es teilt."
        ],
        "1765": [
            "Starke Regenfälle verursachten die Zerstörung der Ponte da Praça und anderer Brücken in der Stadt Funchal. Der Engländer Moita wurde vom Ribeira da Praça oder von João Gomes ins Meer gespült."
        ],
        "1803": [
            "Überschwemmung auf Madeira",
            "Große Überschwemmung"
        ],
        "1804": [
            "Brigadegeneral Reinaldo Oudinot kam nach Madeira, um die Arbeiten zur Kanalisierung der Flüsse zu leiten"
        ],
        "1807": [
            "Tod von Reinaldo Oudinot"
        ],
        "1815": [
            "Überschwemmung vom 26. Oktober"
        ],
        "1842": [
            "Überschwemmung vom 28. Oktober"
        ],
        "1848": [
            "Große Überschwemmungen"
        ],
        "18596": [
            "Äußerst reichliche Regenfälle"
        ],
        "1876": [
            "Überschwemmungen"
        ],
        "1895": [
            "Überschwemmung"
        ],
        "1901": [
            "Äußerst reichliche Regenfälle"
        ],
        "1920": [
            "Sturm mit Wind und Regen"
        ],
        "1921": [
            "Reichliche Regenfälle"
        ]
    }
}