{
    "id": 1831,
    "lang": "de",
    "is_original": false,
    "title": "Städtischer Garten",
    "fl": "S",
    "original_title": "Jardim Municipal",
    "body": "Am 21. Februar 1878 ernannte der Stadtrat von Funchal eine Kommission von Stadträten, die beauftragt wurde, unter der Aufsicht des Zivilgouverneurs die Einrichtung von Gärten im ehemaligen Kloster S. Francisco und auf dem Gelände zwischen diesem Kloster und dem Verfassungsplatz zu fördern. Das Gelände westlich des Verfassungsplatzes wurde kurz darauf bepflanzt, aber die Arbeiten im Kloster S. Francisco begannen erst im August 1880. Der Entwurf und Grundriss des dortigen Gartens wurde vom Stadtrat am 15. September 1881 genehmigt. Um die für diese Arbeiten erforderlichen Ausgaben zu decken, stellte der Stadtrat zunächst 15.000 Escudos aus einem Darlehen von 69.980 Escudos bereit, das 1883 bei der Allgemeinen Hypothekenbank aufgenommen wurde, und später 19.980 Escudos aus einem weiteren Darlehen, das im folgenden Jahr bei derselben Bank aufgenommen wurde.\n\nAls im Oktober 1880 mit den ersten Arbeiten auf dem Gelände des ehemaligen Klosters S. Francisco begonnen wurde, fand man dort, wie es in einem Dokument der damaligen Zeit heißt, \"einen Stein, der als Abdeckung für eine kleine, in einen anderen Stein gehauene Öffnung diente, in der einige Reste gefunden wurden, die wie verfaultes Pergament aussahen\". Der Stein oder die Abdeckung wurde ins Stadtarchiv gebracht, wo er sich jedoch nicht mehr befindet. Darauf stand folgende Inschrift in goldenen Buchstaben:\n\n> D. Ma. Ia. Königin von P. Pius VI, P. M. Fr. Bernardo \nN. E. P. D. U. S. C. \"Juli 1780\".\n\nAm 1. Oktober 1885 gab der Stadtrat dem neuen Garten den Namen \"Städtischer Garten\", aber am 6. September 1897 wurde dieser Name durch \"Garten D. Amélia\" ersetzt, den er bis zum 27. Oktober 1910 behielt, als beschlossen wurde, die 1885 vergebene Bezeichnung wiederherzustellen. Am 21. März 1902 wurde dort die elektrische Beleuchtung eingeweiht, und 1916 wurde sie verbessert, da man 1911 bereits festgestellt hatte, dass die Stromleitungen in schlechtem Zustand waren.\n\nAm 28. März 1921 um 17 Uhr wurde in Anwesenheit einer riesigen Menschenmenge die Zeremonie zur Grundsteinlegung für das Denkmal abgehalten, das Henrique Vieira de Castro zu Ehren der Piloten errichten wird, die als erste die Strecke Lissabon-Madeira geflogen sind. Die Urkunde wurde, nachdem sie von den anwesenden Behörden unterzeichnet worden war, zusammen mit einigen Münzen in einer Eisenkiste verwahrt, die der Zivilgouverneur in die Fundamente des Bauwerks legte (1921).\n\nDie ersten Pflanzen, die in den Stadtpark eingeführt wurden, kamen aus Paris, später kamen weitere aus Porto und einigen anderen Orten. Unter den Arten, die dort derzeit gedeihen, sind besonders erwähnenswert: die *Pritchardia filifera*, der *Phoenix canariensis* und die *Trachycarpus excelsus*, sehr dekorative Palmen, die *Dammara australis* und der *Ginkgo biloba*, Laubbäume, sowie die *Wigandia macrophylla*, die *Astrapaea Wallichii*, die *Jossinia tinifolia*, die *Plumiera lutea*, die *Pterocarya japonica*, der *Negundo fraxinifolium* und die *Alsophila excelsa*. Am 29. August 1888 beschloss der Stadtrat, 29 Glasscheiben für ein Gewächshaus zu kaufen, das noch heute im Stadtpark steht und in dem einige interessante Arten, hauptsächlich Begonien und Zimmeraralien, gedeihen. Das Gelände und Gebäude des Klosters S. Francisco, auf dem sich der Stadtpark befindet, wurde der Stadtverwaltung per Dekret vom 7. November 1844 überlassen.",
    "categories": [
        "history",
        "culture"
    ],
    "freguesias": [],
    "locations": {},
    "people": {},
    "years": {
        "1878": [
            "Ernannte der Stadtrat von Funchal eine Kommission von Stadträten"
        ],
        "1880": [
            "Die Arbeiten im Kloster S. Francisco begannen erst"
        ],
        "1881": [
            "Entwurf und Grundriss des dortigen Gartens wurde vom Stadtrat genehmigt"
        ],
        "1883": [
            "Darlehen von 69.980 Escudos"
        ],
        "1885": [
            "Gab der Stadtrat dem neuen Garten den Namen \"Städtischer Garten\""
        ],
        "1897": [
            "Dieser Name durch \"Garten D. Amélia\" ersetzt"
        ],
        "1902": [
            "Elektrische Beleuchtung eingeweiht"
        ],
        "1910": [
            "Die 1885 vergebene Bezeichnung wiederherzustellen"
        ],
        "1911": [
            "Stromleitungen in schlechtem Zustand waren"
        ],
        "1916": [
            "Beleuchtung verbessert"
        ],
        "1921": [
            "Zeremonie zur Grundsteinlegung für das Denkmal abgehalten"
        ]
    }
}