{
    "id": 1991,
    "lang": "de",
    "is_original": false,
    "title": "Stadtgrenzen",
    "fl": "S",
    "original_title": "Limites da Cidade",
    "body": "Die Gemeindeverordnung vom 30. Dezember 1909, die von der Bezirkskommission am 3. August 1911 bestätigt wurde, legte fest, dass der städtische Teil der Gemeinde Funchal der Umfang war, der von den Ecken gebildet wird, deren Scheitelpunkte sich auf die folgenden Punkte stützen: 1. Hotel Reid an der Monumentalstraße; 2. Alte Brücke des Ribeiro Seco; 3. Kreuzung der R. do Arcebispo D. Aires mit der Straße des Santa Luzia-Aquädukts; 4. Kreuzung der genannten Straße mit der Avenida de Pedro José de Ornelas; 5. Kreuzung des Weges Palheiro do Ferreiro mit dem Weg des Terço; und 6. Mündung des Ribeira de Gonçalo Aires. Die Verbindung zwischen dem 3. und dem 4. Scheitelpunkt ist als polygone Linie gedacht, die alle Windungen der Straße des Santa Luzia-Aquädukts verfolgt.\n\nDie Stadtgrenzen waren gemäß dem Erlass vom 5. Oktober 1863 wie folgt: im Süden die Strände der Bucht von Funchal; im Osten, in der Gemeinde Santa Maria Maior, die Orte Louros, Forca und Rochinha de Cima; im Norden, in der Gemeinde Santa Luzia, die Orte Vale Formoso, Calçada da Torrinha und Ponte do Deão; und im Westen, in der Gemeinde S. Pedro, die Orte Pico, S. João da Ribeira, Maravilhas, Ribeiro Seco und Ponte Monumental.\n\nVor diesem Erlass war die Stadt durch die Kapelle Santa Catarina, die Brücke von S. Paulo, die Burg von Pico, die Gasse der Arrifes bis zur oberen Mühle, die Kirche von Santa Luzia, Pena, Rochinha und dem Scheideweg von Forca begrenzt, wobei diese Grenzen von einem Ausschuss festgelegt wurden, der in der Stadtratssitzung vom 19. Dezember 1809 ernannt wurde.\n\nDie Stadt begann sich nach der Flut von 1803 in Richtung Ribeiro Seco und Caminho do Monte auszudehnen, da viele Gebäude in der Stadt zerstört worden waren und viele Familien keine Unterkunft hatten.\n\nDer Stadtrat beschloss in seiner ordentlichen Sitzung vom 17. Oktober 1927, der Stadt ein übermäßig großes Gebiet zu geben, das tief in die Vorortgemeinden hineinreichte, und legte ihre Grenzen in folgenden, wenn auch nicht sehr klaren Begriffen fest: \"Vom Meer in gerader Linie zum Verbindungsweg zwischen der Nationalstraße Nr. 23 und dem Alten Weg von S. Gonçalo, Weg der Kirche von S. Gonçalo, Weg des Palheiro Ferreiro, Weg des Terço, Weg des Levada do Bom Sucesso, in gerader Linie zur Straße des Aquädukts von Santa Luzia, von hier aus in gerader Linie zur Coelha-Mauer (Norden des Anwesens Drolhe), Weg des Água de Mel, Pappeln, Brücke über den Ribeira Grande, Anwesen Leme, Säule, Aussichtspunkt für Schiffe, Weg von São Martinho und Amparo zur Monumentalstraße und in gerader Linie bis zum Meer\".\n\nMit diesen neuen Grenzen erhielt die Stadt eine fast doppelt so große Fläche und nahm wirklich übertriebene Ausmaße an. Nach dem Ratsbeschluss von 1909 umfasste die Stadt die Gemeinden Sé und Santa Luzia, fast die gesamte Gemeinde São Pedro sowie einen beträchtlichen Teil der Gemeinde Santa Maria, weshalb sie Stadtgemeinden genannt wurden. Nach der neuen Stadteinteilung von 1927 bestand die Hauptstadt des Bezirks aus dem 1909 festgelegten Gebiet plus der Fläche, die ihr die Vorortgemeinden São Martinho, Santo António, São Roque und São Gonçalo hinzufügten, wobei die Gemeinde Monte die einzige ist, die nicht zum kürzlich für die Stadtgrenzen festgelegten Umfang gehört. Ihre alte Fläche, die auf etwa fünfhundert Hektar geschätzt wurde, muss heute eine Fläche von etwa 750 Hektar erreichen. Tatsache ist, dass die übermäßige Erweiterung der Stadt nicht den Erwartungen der Bevölkerung entsprach, die weiterhin die Grenzen berücksichtigt, die der Stadt 1909 logischerweise und korrekt gesetzt wurden. Die offizielle Volkszählung für 1920 weist der Stadt eine Einwohnerzahl von 24.284 zu, die heute durch das natürliche Bevölkerungswachstum und die 1927 erfolgte Stadterweiterung deutlich gestiegen ist, wie bereits erwähnt.",
    "categories": [
        "geography"
    ],
    "freguesias": [
        "Sé",
        "Santa Luzia",
        "São Pedro",
        "Santa Maria",
        "São Martinho",
        "Santo António",
        "São Roque",
        "São Gonçalo",
        "Monte"
    ],
    "locations": {},
    "people": {},
    "years": {
        "1909": [
            "Gemeindeverordnung vom 30. Dezember"
        ],
        "1911": [
            "Von der Bezirkskommission am 3. August bestätigt"
        ],
        "1863": [
            "Erlass vom 5. Oktober"
        ],
        "1809": [
            "Ausschuss, der in der Stadtratssitzung vom 19. Dezember ernannt wurde"
        ],
        "1803": [
            "Nach der Flut von 1803"
        ],
        "1927": [
            "Ordentlichen Sitzung vom 17. Oktober"
        ]
    }
}