{
    "id": 595,
    "lang": "de",
    "is_original": false,
    "title": "Bugio",
    "fl": "B",
    "original_title": "Bugio",
    "body": "Es ist eine der drei Desertas und eine der fünf Inseln, die den Archipel von Madeira bilden. Sein Name leitet sich, sagt das Dic. Univ. Port. II., von dem Umstand ab, dass es dem Affen ähnelt, der diesen Namen trägt; es ist fünf Meilen oder etwas mehr als neun Kilometer lang und eine halbe Meile oder 926 Meter breit; es endet im Süden an der Ponta da Agulha, einem der äußersten Punkte des Archipels; es besteht aus hohen, fast unzugänglichen Felsen, hat aber gute Weiden.\n\nDer höchste Gipfel des Bugio liegt 411 Meter über dem Meeresspiegel.\n\nBugio ist unbebaut, hat kein Wasser und kein einziges Haus. Es produziert Mohn, Quecke, Disteln und andere Kräuter, von denen einige Futterpflanzen sind. Auf der Spitze der Insel und in der Nähe des südlichen Endes finden sich einige fossile Muscheln, und an den Meeresfelsen findet man die sehr seltene Chrysanthemum haematomma, eine eigentümliche Zusammensetzung, bemerkenswert für ihre schönen Köpfe mit schwarzen purpurnen Scheibenblüten und weißen oder rosa Randblüten.\n\nAus den Registern des Notariats des Kreises Funchal geht hervor, dass Bugio am 3. Oktober 1867 João de Vasconcelos de Sousa Câmara Caminha Faro e Veiga, Marquês von Castelo Melhor, gehörte und nach dessen Tod von Alexandre Fernandes Camacho Júnior ersteigert wurde. Heute gehört es Carlos Cossart und Henrique Hinton, die es zusammen mit den beiden anderen Desertas am 24. November 1894 ersteigerten, als die Güter des genannten Alexandre Camacho versteigert wurden.\n\nBugio gehört zur Pfarrei Sé und hat einen kleinen natürlichen Hafen im Westen, genannt A Alagoa.",
    "categories": [
        "geography",
        "history"
    ],
    "freguesias": [
        "Sé"
    ],
    "locations": {
        "Sé": [
            "Bugio gehört zur Pfarrei"
        ]
    },
    "people": {
        "João de Vasconcelos de Sousa Câmara Caminha Faro e Veiga": [
            "Marquês von Castelo Melhor"
        ],
        "Alexandre Fernandes Camacho Júnior": [
            "Ersteigert wurde. Heute gehört es Carlos Cossart und Henrique Hinton"
        ]
    },
    "years": {
        "1867": [
            "João de Vasconcelos de Sousa Câmara Caminha Faro e Veiga"
        ],
        "1894": [
            "Carlos Cossart und Henrique Hinton"
        ]
    }
}