{
    "id": 1628,
    "lang": "en",
    "is_original": false,
    "title": "Civil Governors",
    "fl": "C",
    "original_title": "Governadores Civis",
    "body": "Under the designation of Civil Governors, we present here the complete list of the highest authorities of this district since the establishment of the constitutional government, although some of these authorities were named Prefect and General Administrator:\n\nLuiz da Silva Mousinho de Albuquerque (1834),\nConde de Carvalhal (1835),\nAntonio de Gamboa e Liz (1835),\nBarão de Lordelo (1838),\nDomingos Olavo Correia de Azevedo (1841),\nJosé Silvestre Ribeiro (1846),\nVisconde de Fornos de Algodres (1852),\nJosé Gerardo Ferreira Passos (1854),\nAntonio Rogerio Gromicho Couceiro (1856),\nJosé Maria Baldy (1858),\nConde de Farrobo (1860),\nJanuario Correia de Almeida (1862),\nJacinto Antonio Perdigão (1863),\nD. João Frederico da Câmara Leme (1868),\nMarquês de Sesimbra (1868),\nVisconde de Andaluz (1869),\nAfonso de Castro (1870),\nD. João Frederico da Câmara Leme (1870),\nFrancisco de Albuquerque Mesquita e Castro (1876),\nAfonso de Castro (1877),\nVisconde de Vila Mendo (1881),\nVisconde de Vila Mendo (1882),\nTomaz Nunes de Serra e Moura (1884),\nVasco Guedes de Carvalho e Meneses (1884),\nVisconde de Canavial (1884),\nD. João de Alarcão Valasques Sarmento Osorio (1885).\nJosé de Azevedo Castelo Branco (1890),\nD. Manuel Saldanha da Gama (1890),\nLuiz do Canto de Castro Merens de Tavora (1892)\nD. Manuel Saldanha da Gama (1893),\nAntonio Augusto de Sousa e Silva (1894),\nJosé Ribeiro da Cunha (1896),\nJosé Antonio de Almada (1897),\nMarquês do Funchal (1899),\nD. Tomás de Almeida Manuel de Vilhena (1900),\nD. Bernardo da Costa de Sousa Macedo (1901),\nJosé Ribeiro da Cunha (1901),\nMarquês do Funchal (1904),\nJoão de Soares Branco (1906),\nJosé Ribeiro da Cunha (1906),\nD. Bernardo da Costa de Sousa Macedo (1906),\nBoaventura Mendes de Almeida (1907),\nJoão de Paiva de Faria Leite Brandão (1908),\nAfonso de Melo Pinto Veloso (1910),\nJosé Ribeiro da Cunha (1910),\nManuel Augusto Martins (1910),\nJoão Maria de Santiago Prezado (1912),\nAlfredo Ernesto de Sá Cardoso (1913)\nVasco Borges (1914),\nSebastião Heredia (1914),\nJosé Vicente de Freitas (1915),\nSebastião Heredia (1915),\nJosé de Sousa Rosa (1917),\nDaniel Telo Simões Soares (1917),\nCarlos José Barata Pinto Feio (1918),\nAmerico Ciriaco Correia da Silva (1918),\nManuel Augusto Martins (1919),\nDaniel Telo Simões Soares (1919),\nVasco Crispiniano da Silva (1920),\nAntonio da Cruz Rodrigues dos Santos (1920),\nJoão Miguel Rodrigues da Silva (1920),\nAntonio Augusto da Silva Pereira (1921)\nAires de Mesquita Espranger (1921),\nAcacio Augusto Correia Pinto (1921),\nAlvaro Nobre da Veiga (1922),\nEduardo Rocha Sarsfield (1922),\nJoão Augusto de Freitas (1922),\nDaniel Telo Simões Soares (1923),\nJulio Ferreira Cabral (1924)\nJosé Varela (1924)\nAntonio C. Rodrigues Leitão (1924),\nJoão Guilherme Meneses Ferreira (1925),\nManuel dos Santos Mendonça (1926),\nFrancisco Martins Luzignan de Azevedo (1926),\nErnesto Florencio Cunha (1927)\nJosé Maria de Freitas (1928),\nArtur Almeida Cabaço (1931),\nAntonio Caldeira Coelho (1934)\nAugusto Goulart de Medeiros (1934),\nJosé Nosolini Pinto Osorio da Silva Leão (1938),\nGustavo Teixeira Dias (1941).",
    "categories": [
        "history"
    ],
    "freguesias": [],
    "locations": {},
    "people": {
        "Luiz da Silva Mousinho de Albuquerque": [
            "1834"
        ],
        "Conde de Carvalhal, Antonio de Gamboa e Liz": [
            "1835"
        ],
        "Barão de Lordelo": [
            "1838"
        ],
        "Domingos Olavo Correia de Azevedo": [
            "1841"
        ],
        "José Silvestre Ribeiro": [
            "1846"
        ],
        "Visconde de Fornos de Algodres": [
            "1852"
        ],
        "José Gerardo Ferreira Passos": [
            "1854"
        ],
        "Antonio Rogerio Gromicho Couceiro": [
            "1856"
        ],
        "José Maria Baldy": [
            "1858"
        ],
        "Conde de Farrobo": [
            "1860"
        ],
        "Januario Correia de Almeida": [
            "1862"
        ],
        "Jacinto Antonio Perdigão": [
            "1863"
        ],
        "D. João Frederico da Câmara Leme, Marquês de Sesimbra": [
            "1868"
        ],
        "Visconde de Andaluz": [
            "1869"
        ],
        "Afonso de Castro, D. João Frederico da Câmara Leme": [
            "1870"
        ],
        "Francisco de Albuquerque Mesquita e Castro": [
            "1876"
        ],
        "Afonso de Castro": [
            "1877"
        ],
        "Visconde de Vila Mendo": [
            "1882"
        ],
        "Tomaz Nunes de Serra e Moura, Vasco Guedes de Carvalho e Meneses, Visconde de Canavial": [
            "1884"
        ],
        "D. João de Alarcão Valasques Sarmento Osorio": [
            "1885"
        ],
        "José de Azevedo Castelo Branco, D. Manuel Saldanha da Gama": [
            "1890"
        ],
        "Luiz do Canto de Castro Merens de Tavora": [
            "1892"
        ],
        "D. Manuel Saldanha da Gama": [
            "1893"
        ],
        "Antonio Augusto de Sousa e Silva": [
            "1894"
        ],
        "José Ribeiro da Cunha": [
            "1896"
        ],
        "José Antonio de Almada": [
            "1897"
        ],
        "Marquês do Funchal": [
            "1904"
        ],
        "D. Tomás de Almeida Manuel de Vilhena": [
            "1900"
        ],
        "D. Bernardo da Costa de Sousa Macedo, José Ribeiro da Cunha": [
            "1901"
        ],
        "João de Soares Branco, José Ribeiro da Cunha, D. Bernardo da Costa de Sousa Macedo": [
            "1906"
        ],
        "Boaventura Mendes de Almeida": [
            "1907"
        ],
        "João de Paiva de Faria Leite Brandão": [
            "1908"
        ],
        "Afonso de Melo Pinto Veloso, José Ribeiro da Cunha, Manuel Augusto Martins": [
            "1910"
        ],
        "João Maria de Santiago Prezado": [
            "1912"
        ],
        "Alfredo Ernesto de Sá Cardoso": [
            "1913"
        ],
        "Vasco Borges, Sebastião Heredia": [
            "1914"
        ],
        "José Vicente de Freitas, Sebastião Heredia": [
            "1915"
        ],
        "José de Sousa Rosa, Daniel Telo Simões Soares": [
            "1917"
        ],
        "Carlos José Barata Pinto Feio, Americo Ciriaco Correia da Silva": [
            "1918"
        ],
        "Manuel Augusto Martins, Daniel Telo Simões Soares": [
            "1919"
        ],
        "Vasco Crispiniano da Silva, Antonio da Cruz Rodrigues dos Santos, João Miguel Rodrigues da Silva": [
            "1920"
        ],
        "Antonio Augusto da Silva Pereira, Aires de Mesquita Espranger, Acacio Augusto Correia Pinto": [
            "1921"
        ],
        "Alvaro Nobre da Veiga, Eduardo Rocha Sarsfield, João Augusto de Freitas": [
            "1922"
        ],
        "Daniel Telo Simões Soares": [
            "1923"
        ],
        "Julio Ferreira Cabral, José Varela, Antonio C. Rodrigues Leitão, João Guilherme Meneses Ferreira": [
            "1924"
        ],
        "João Guilherme Meneses Ferreira": [
            "1925"
        ],
        "Manuel dos Santos Mendonça, Francisco Martins Luzignan de Azevedo": [
            "1926"
        ],
        "Ernesto Florencio Cunha": [
            "1927"
        ],
        "José Maria de Freitas": [
            "1928"
        ],
        "Artur Almeida Cabaço": [
            "1931"
        ],
        "Antonio Caldeira Coelho, Augusto Goulart de Medeiros": [
            "1934"
        ],
        "José Nosolini Pinto Osorio da Silva Leão": [
            "1938"
        ],
        "Gustavo Teixeira Dias": [
            "1941"
        ]
    },
    "years": {}
}