{
    "id": 1767,
    "lang": "ru",
    "is_original": false,
    "title": "Островки",
    "fl": "О",
    "original_title": "Ilhéus",
    "body": "Основные островки вблизи побережья Мадейры: на южном побережье - Агоштинью, Дезембаркадурош и де Фора (мыс Сан-Лоренсу), Санта-Катарина (Санта-Круш), Ильеу (бухта Фуншала), Горгулью и Прая (Сан-Мартинью), Кампанариу или Лапа (Кампанариу), Гиншу (мыс Паргу); на северном побережье - Моли и Негру (Порту-ду-Мониш), Рибейра-да-Жанела (Рибейра-да-Жанела), Сейшала, известные как Серулаш и Гиншу (Сейшал), Боавентура или Прету и Вермелью (Боавентура). Сан-Жоржи (Сан-Жоржи), Роша-ду-Навиу (Сантана), Файала, главный - Файала (Файал), Порту-да-Круш (Порту-да-Круш). \n\nОсновные островки вокруг острова Порту-Санту: Сенураш, Байшу или да Кал, Сима или Драгейруш, сегодня также Фарол, Фора или Роша-ду-Нордешти, Фонти или Фонти-да-Арея, Ферру (см. каждое из этих названий).\n\nВ группе Дезерташ находится островок Фурильян или Прегу-ду-Мар (см. эти названия), также известный как островок Навиу.",
    "categories": [
        "geography"
    ],
    "freguesias": [],
    "locations": {
        "Мыс Сан-Лоренсу": [
            "Дезембаркадурош и де Фора"
        ],
        "Санта-Круш": [
            "Санта-Катарина"
        ],
        "Фуншал": [
            "Ильеу"
        ],
        "Сан-Мартинью": [
            "Горгулью и Прая"
        ],
        "Кампанариу": [
            "Кампанариу или Лапа"
        ],
        "Мыс Паргу": [
            "Гиншу"
        ],
        "Порту-ду-Мониш": [
            "Моли и Негру"
        ],
        "Рибейра-да-Жанела": [
            "Рибейра-да-Жанела"
        ],
        "Сейшал": [
            "Серулаш и Гиншу"
        ],
        "Боавентура": [
            "Прету и Вермелью"
        ],
        "Сан-Жоржи": [
            "Сан-Жоржи"
        ],
        "Сантана": [
            "Роша-ду-Навиу"
        ],
        "Файал": [
            "Главный Файала"
        ],
        "Порту-да-Круш": [
            "Порту-да-Круш"
        ],
        "Порту-Санту": [
            "Сенураш, Байшу или да Кал, Сима или Драгейруш, Фарол, Фора или Роша-ду-Нордешти, Фонти или Фонти-да-Арея, Ферру"
        ],
        "Дезерташ": [
            "Фурильян или Прегу-ду-Мар, Навиу"
        ]
    },
    "people": {},
    "years": {}
}