{
    "id": 1831,
    "lang": "ru",
    "is_original": false,
    "title": "Муниципальный сад",
    "fl": "М",
    "original_title": "Jardim Municipal",
    "body": "21 февраля 1878 года муниципальный совет Фуншала назначил комиссию из членов совета, ответственную за создание садов на территории бывшего монастыря Святого Франциска и на участке между этой территорией и Конституционной площадью под надзором гражданского губернатора. Участок к западу от Конституционной площади был обустроен садом вскоре после этого, но работы на территории монастыря Святого Франциска начались только в августе 1880 года, а проект и план существующего там сада были утверждены муниципалитетом 15 сентября 1881 года. Чтобы покрыть расходы на эти работы, муниципалитет сначала выделил 15 тысяч контос, перенаправив их из займа в размере 69 980$000 реалов, полученного в 1883 году от Общей ипотечной кредитной компании, а затем сумму в 19 980$000 реалов из другого займа, полученного в следующем году от той же компании.\n\nВ октябре 1880 года, когда на территории бывшего монастыря Святого Франциска проводились первые работы, там, как говорится в документе того времени, «был найден камень, служивший крышкой небольшого углубления, высеченного в другом камне, в котором находились остатки, похожие на сгнивший пергамент». Камень или крышка были отправлены в муниципальный архив, где их, впрочем, нет, и на них была следующая надпись золотыми буквами:\n\n> D. Ma. Ia. Королева Португалии Папа Пий VI, P. M. Fr. Бернардо \nN. E. P. D. U. S. C. Июль 1780.\n\n1 октября 1885 года муниципалитет дал новому саду название Муниципальный сад, но 6 сентября 1897 года это название было заменено на Сад Доньи Амелии, которое сохранялось до 27 октября 1910 года, когда было решено восстановить название, данное в 1885 году. 21 марта 1902 года там было установлено электрическое освещение, а в 1916 году оно было улучшено, поскольку уже в 1911 году было признано, что провода для передачи энергии находятся в плохом состоянии.\n\n28 марта 1921 года в 17:00 перед огромной толпой состоялась церемония закладки первого камня памятника, который господин Энрике Виейра де Кастро собирается воздвигнуть в Муниципальном саду в честь летчиков, впервые совершивших рейд Лиссабон-Мадейра, акт был подписан властями, присутствовавшими на церемонии, и вместе с несколькими монетами помещен в железный ящик, который гражданский губернатор положил в основание сооружения (1921).\n\nПервые растения, завезенные в Муниципальный сад, прибыли из Парижа, позже поступили другие из Порту и некоторых других мест. Среди видов, которые в настоящее время произрастают там, особого упоминания заслуживают *Pritchardia filifera*, *Phoenix canariensis* и *Trachycarpus excelsus*, очень декоративные пальмы, *Dammara australis* и *Ginkgo biloba*, хвойные с широкими листьями, а также *Wigandia macrophylla*, *Astrapaea Wallichii*, *Jossinia tinifolia*, *Plumiera lutea*, *Pterocarya japonica*, *Negundo fraxinifolium* и *Alsophila excelsa*. 29 августа 1888 года муниципалитет решил купить двадцать девять витражей для теплицы, которая до сих пор существует в Муниципальном саду и где растут некоторые любопытные виды, в основном бегонии и аспарагусы. Территория и здания монастыря Святого Франциска, где находится Муниципальный сад, были переданы муниципалитету указом от 7 ноября 1844 года.",
    "categories": [
        "history",
        "culture"
    ],
    "freguesias": [],
    "locations": {},
    "people": {},
    "years": {
        "1878": [
            "Муниципальный совет Фуншала назначил комиссию"
        ],
        "1880": [
            "Работы на территории монастыря Святого Франциска начались"
        ],
        "1881": [
            "Проект и план существующего там сада были утверждены муниципалитетом"
        ],
        "1883": [
            "Займа в размере 69 980$000 реалов"
        ],
        "1885": [
            "Муниципалитет дал новому саду название Муниципальный сад"
        ],
        "1897": [
            "Это название было заменено на Сад Доньи Амелии"
        ],
        "1902": [
            "Там было установлено электрическое освещение"
        ],
        "1910": [
            "Было решено восстановить название, данное в 1885 году"
        ],
        "1911": [
            "Было признано, что провода для передачи энергии находятся в плохом состоянии"
        ],
        "1916": [
            "Оно было улучшено"
        ],
        "1921": [
            "Состоялась церемония закладки первого камня памятника"
        ]
    }
}