{
    "id": 2591,
    "lang": "ru",
    "is_original": false,
    "title": "Судебная организация",
    "fl": "С",
    "original_title": "Organização Judicial",
    "body": "Во времена абсолютизма весь архипелаг Мадейра составлял один округ, центром которого был Фуншал, с одним судьей и одним внештатным судьей, оба назначались королем. Тот же округ был разделен на пять судебных участков, каждый со своим мировым судьей, а именно: Машику, Санта-Круш, Понта-ду-Сол, Кальета и Сан-Висенте. Кроме того, был судья по остаточным делам и три судьи по делам сирот, один в Фуншале, другой в Кальете и третий в Сан-Висенте. Всеми этими судьями руководил Судебный совет, который, как мы где-то прочитали, решал все уголовные дела, за которые полагалось наказание не более десяти лет ссылки, и решения которого можно было обжаловать в высших судах Королевства в Лиссабоне.\n\n15 октября 1835 года закончился старый судебный режим, были учреждены два судебных участка в Фуншале, каждый со своим судьей, а в 1838 году эти участки стали называться округами – восточным и западным. В восточном округе было четыре судебных участка, в западном – пять, каждым участком руководил мировой судья. Восточный округ простирался от прихода Се до прихода Арко-де-Сан-Жорже, в него также входил остров Порту-Санту. Западный округ шел от прихода Сан-Педру до прихода Понта-Делгада-и-Боавентура, который раньше входил в приход Арко-де-Сан-Жорже. 27 мая 1838 года состоялись выборы мировых судей для вновь созданных судебных участков.\n\nУказ от 12 ноября 1875 года учредил четыре судебных округа в Фуншале, ниже приводится нынешняя организация мировых судов этих округов:\n\nФуншальский округ. Девять мировых участков: Сан-Педру – приходы Сан-Педру и Сан-Роке; Се – приходы Се, Санта-Лузия и Монте; Санта-Мария-Майор – приходы Санта-Мария-Майор и Сан-Гонсалу; Кампанариу – приходы Кампанариу и Кинта-Гранде; Сан-Мартинью, Санту-Антониу, Камара-ди-Лобуш, Эштрейту-ди-Камара-ди-Лобуш и Порту-Санту – приходы с теми же названиями.\n\nОкруг Понта-ду-Сол. Пять мировых участков: Понта-ду-Сол – приходы Понта-ду-Сол, Каньяш и Мадалена-ду-Мар; Рибейра-Брава – приходы Рибейра-Брава, Табуа и Серра-ди-Агуа; Кальета – приходы Кальета и Арку-да-Кальета; Эштрейту-да-Кальета – приходы Эштрейту-да-Кальета, Жардин-ду-Мар и Празериш; Понта-ду-Паргу – приходы Понта-ду-Паргу, Фажа-да-Овелья, Паул-ду-Мар и Ашадаш-да-Круш.\n\nОкруг Сан-Висенте. Пять мировых участков: Сан-Висенте – одноименный приход; Порту-ду-Мониш – приходы Сейшал, Рибейра-да-Жанела и Порту-ду-Мониш; Понта-Делгада – приходы Понта-Делгада и Боавентура; Сан-Жорже – приходы Сан-Жорже и Арку-де-Сан-Жорже; Сантана – приходы Сантана, Файал и Сан-Роке-ду-Файал.\n\nОкруг Санта-Круш. Четыре мировых участка: Канису – приходы Канису и Камаша; Машику – приходы Машику, Канисал, Агуа-ди-Пена (часть) и Санту-Антониу-да-Серра (часть); Порту-да-Круш – одноименный приход; Санта-Круш – приходы Санта-Круш, Гаула, Агуа-ди-Пена (часть) и Санту-Антониу-да-Серра (часть).\n\nДолжности прежних мировых судей, работавших в судебных участках, были упразднены указом от 29 июля 1886 года.\n\nВышеупомянутая судебная организация была серьезно изменена после упразднения округа Сан-Висенте указом от 9 июня 1927 года. В 1931 году был создан муниципальный судебный участок, охватывающий три прихода округа.",
    "categories": [
        "politics"
    ],
    "freguesias": [],
    "locations": {
        "Мадейра": [
            "Весь архипелаг Мадейра составлял один округ"
        ],
        "Фуншал": [
            "Центром которого был Фуншал"
        ],
        "Лиссабон": [
            "Решения которого можно было обжаловать в высших судах Королевства в Лиссабоне"
        ],
        "Порту-Санту": [
            "В него также входил остров Порту-Санту"
        ]
    },
    "people": {},
    "years": {
        "1835": [
            "15 октября 1835 года закончился старый судебный режим"
        ],
        "1838": [
            "В 1838 году эти участки стали называться округами"
        ],
        "1875": [
            "Указ от 12 ноября 1875 года учредил четыре судебных округа в Фуншале"
        ],
        "1886": [
            "Должности прежних мировых судей, работавших в судебных участках, были упразднены указом от 29 июля 1886 года"
        ],
        "1927": [
            "После упразднения округа Сан-Висенте указом от 9 июня 1927 года"
        ],
        "1931": [
            "В 1931 году был создан муниципальный судебный участок"
        ]
    }
}