{
    "id": 3110,
    "lang": "ru",
    "is_original": false,
    "title": "Родригес (Адольфо де Соуза)",
    "fl": "Р",
    "original_title": "Rodrigues (Adolfo de Sousa)",
    "body": "Этот выдающийся художник, чья преждевременная смерть и упорная болезнь в последние годы его жизни не позволили ему проявить всю мощь его таланта, родился в Фуншале 13 января 1867 года и умер в городе Лиссабон 9 марта 1908 года.\n\nОн окончил Академию изящных искусств, где всегда получал высокие оценки, прославившись изучением исторической живописи, в которой он выиграл первый приз за картину «Герой и Леандр». Он изучал эту специальность с Жозе Феррейрой Шавешем, а затем поехал в Париж, чтобы совершенствоваться у Поля Лорана и Бенжамена Констана. На втором году обучения в Академии он также получил приз «Благовещение». На выставке Художественной гильдии в Лиссабоне в 1895 году он получил третью медаль. Он принимал участие в различных выставках, где, среди прочих, были представлены его картины «Искушение Христа» и «Добрый самаритянин».\n\nОн написал портрет короля Карлоса I, который находился в зале заседаний муниципалитета Фуншала, портрет нашего выдающегося соотечественника Агоштинью ди Орнелаш и Вашконселуша и т.д. У него были академические пальмы Французской академии и орден Изабеллы Католической Испании.",
    "categories": [
        "art"
    ],
    "freguesias": [],
    "locations": {
        "Фуншал": [
            "Родился в Фуншале"
        ],
        "Лиссабон": [
            "Умер в городе Лиссабон"
        ]
    },
    "people": {
        "Адольфо де Соуза Родригес": [
            "Выдающийся художник"
        ],
        "Жозе Феррейра Шавеш": [
            "Специальность с Жозе Феррейрой Шавешем"
        ],
        "Поль Лоран": [
            "Совершенствоваться у Поля Лорана"
        ],
        "Бенжамен Констан": [
            "Совершенствоваться у Бенжамена Констана"
        ],
        "Карлос I": [
            "Портрет короля Карлоса I"
        ],
        "Агоштинью ди Орнелаш и Вашконселуш": [
            "Портрет нашего выдающегося соотечественника Агоштинью ди Орнелаш и Вашконселуша"
        ]
    },
    "years": {
        "1867": [
            "Родился"
        ],
        "1908": [
            "Умер"
        ],
        "1895": [
            "Получил третью медаль"
        ]
    }
}