{
    "id": 1978,
    "lang": "uk",
    "is_original": false,
    "title": "Лейхтенберзький (герцог)",
    "fl": "Л",
    "original_title": "Leuchtenberg (Duque de)",
    "body": "23 серпня 1849 року в нашому порту закинула якір російська фрегата «Камчатка», на борту якої перебував князь Максиміліан, герцог Лейхтенберзький, брат князя Августа, першого чоловіка королеви Марії ІІ, та королеви Амелії, вдови короля Педру IV. Корабель перебував на карантині, і князь зміг висадитися на берег лише 27 серпня, де його чекали урочистості, організовані тогочасним губернатором Жозе Сілвестре Рібейру.\n\nКнязь відвідав багато приходів Мадейри, а також острів Порту-Санту, захоплюючись природними красотами нашого архіпелагу. Він залишався на цьому острові до 23 квітня 1850 року, коли відплив у напрямку Росії. Серед нас він залишив найкращі спогади не лише завдяки своїй надзвичайній простоті, а й щирим проявам милосердя до бідних нашої землі.\n\nГерцог Лейхтенберзький, який був сином знаменитого князя Євгена Наполеона та зятем імператора Миколи I, прибув на Мадейру для полегшення своїх страждань і, прощаючись, заявив крізь сльози, що тут він провів деякі з найщасливіших і найспокійніших днів свого життя.\n\nДо його свити входили князь П'єр Багратіон, граф Ожаровський, капітан Паучин, секретар Ежен Мюссар, лікар доктор С. Фішер та п'ятнадцять слуг.\n\nВін мешкав у маєтку Ангуштіяш, де раніше також мешкала королева Аделаїда Англійська, і де померла у 1853 році принцеса Марія Амелія. У 1850 році він відвідав Порту-Санту на російській фрегаті «Паллас».\n\nСин князя Максиміліана, князь Микола Максиміліан, також герцог Лейхтенберзький, відвідав Мадейру у 1886 році. Він прибув до порту Фуншала 1 грудня та висадився наступного дня. Йому були віддані належні військові почесті як князю, спорідненому з королівськими домами Португалії та Росії.\n\nКнязь Микола провів частину 1887 року на Мадейрі, відпливши до Європи 16 червня.",
    "categories": [
        "history"
    ],
    "freguesias": [
        "Santa Maria Maior"
    ],
    "locations": {
        "Порту-Санту": [
            "Острів"
        ]
    },
    "people": {
        "Максиміліан": [
            "Князь"
        ],
        "Августа": [
            "Князь"
        ],
        "Марії ІІ": [
            "Королева"
        ],
        "Амелії": [
            "Королева"
        ],
        "Педру IV": [
            "Король"
        ],
        "Євгена Наполеона": [
            "Князь"
        ],
        "Миколи I": [
            "Імператор"
        ],
        "П'єр Багратіон": [
            "Князь"
        ],
        "Ожаровський": [
            "Граф"
        ],
        "Паучин": [
            "Капітан"
        ],
        "Ежен Мюссар": [
            "Секретар"
        ],
        "Доктор С. Фішер": [
            "Лікар"
        ],
        "Аделаїда Англійська": [
            "Королева"
        ],
        "Марія Амелія": [
            "Принцеса"
        ],
        "Микола Максиміліан": [
            "Князь"
        ]
    },
    "years": {}
}