{
    "id": 2848,
    "lang": "uk",
    "is_original": false,
    "title": "Мис Святого Лаврентія",
    "fl": "М",
    "original_title": "Ponta de São Lourenço",
    "body": "Він знаходиться на східному краю Мадейри, і, за словами Фрутуозо, отримав свою назву, оскільки Святий Лаврентій був названий корабель, на якому прибув капітан Жуан Гонсалвес Зарку, коли острів був відкритий.\n\n## Мис Святого Лаврентія\n\n«Мис Святого Лаврентія, каже Моусінью де Албукерке, який простягається майже на 3 милі в море в напрямку з заходу на схід з дуже невеликою шириною, складається з послідовності залишків гір, які, здається, були зруйновані в основному: і незабаром після проходження поселення Канісал, він загалом представляє залишки шарів, які занурюються на південь або південний захід, і які з північної сторони раптово і вертикально розрізані, утворюючи майже вертикальні обриви над морем.»\n\nПід час літа мис Святого Лаврентія посушливий і сумний, тому що спека сонця дуже швидко висушує рослинність, яка вкриває землі; але протягом першої частини весни, коли невеликі долини та пагорби прикрашені в деяких місцях розкішним килимом зелені, серед якого виділяються різні види, яких не знайти в жодній іншій точці острова, вигляд цього місця дуже змінюється, до якого життя природи додає принади, які тішать і радують відвідувача.\n\nІлеу-ді-Фора, де знаходиться маяк, вважається частиною мису, хоча він відокремлений від сусідньої землі каналом або гирлом шириною близько 85 сажнів і глибиною 3-4 сажні. На захід розташовані Ілеу-дус-Дезембаркадурус та Агостінью, за ними слідує затока Абра, де є причал (див. цю назву), а потім місце П'єдаді з пляжем з вапнякового піску, єдиним такого роду, який існує на острові. На пагорбі біля пляжу знаходиться невелика каплиця Носса-Сеньйора-да-П'єдаді (див. цю назву).\n\nВся територія мису зараз повністю знеліснена, але біля пляжу, про який ми щойно говорили, існує багато вапнякових утворень, які, як усе вказує на те, є скам'янілими рештками деревних рослин, що свідчить про те, що в досить давні часи в цьому місці були деякі ліси. (Див. Вапнякові утворення).\n\nНа місці П'єдаді знаходиться багато наземних мушель, що належать до видів високогірного регіону, небагато з яких зустрічаються живими в цій місцевості. Цей досить цікавий факт ще не отримав задовільного пояснення.\n\nУ деяких місцях мису Святого Лаврентія випасаються деякі худоби, а Ілеу-дус-Дезембаркадурус та землі Абри славляться великою кількістю кормових рослин, які вони виробляють. Найкраще сіно острова надходить з мису Святого Лаврентія.\n\nНа всьому мисі відчувається велика нестача джерел, але дощі там рясні з осені до весни. Землі могли б виробляти зернові культури, якби худоба не знищувала посіви.\n\nОсобливий інтерес до цієї теми становлять статті *Агостінью* (Ілеу-ду), *Дезембаркадейру* (Ілеу-ду) *Маяки та Вапнякові утворення П'єдаді*.",
    "categories": [
        "geography"
    ],
    "freguesias": [],
    "locations": {
        "Мис Святого Лаврентія": [
            "Східний край Мадейри"
        ],
        "Канісал": [
            "Поселення Канісал"
        ],
        "Ілеу-ді-Фора": [
            "Де знаходиться маяк"
        ],
        "Ілеу-дус-Дезембаркадурус": [
            "На захід"
        ],
        "Ілеу де Агостінью": [
            "На захід"
        ],
        "Затока Абра": [
            "Де є причал"
        ],
        "П'єдаді": [
            "Місце П'єдаді"
        ]
    },
    "people": {},
    "years": {}
}