{
    "id": 1767,
    "lang": "ua",
    "is_original": false,
    "title": "Острови",
    "fl": "О",
    "original_title": "Ilhéus",
    "body": "Основні прибережні острови біля узбережжя Мадейри: на південному узбережжі: Агоштінью, Дезембаркадуруш і де Фора (мис Сан-Лоренсу), Санта-Катаріна (Санта-Круш), Ільєу (бухта Фуншала), Ґорґулью і Прая (Сан-Мартінью), Кампанаріу або Лапа (Кампанаріу), Ґвінчу (мис Парґу); на північному узбережжі: Молі і Неґру (Порту-ду-Моніш), Рібейра-да-Жанела (Рібейра-да-Жанела), Сейшал, відомі як Серулаш і Ґвінчу (Сейшал), Боавентура або Прету і Вермелью (Боавентура). Сан-Жоржі (Сан-Жоржі), Роша-ду-Навіу (Сантана), Файал, головний - Файал (Файал) і Порту-да-Круш (Порту-да-Круш). \n\nОсновні острови навколо острова Порту-Санту: Сенураш, Байшу або да Кал, Сіма або душ Драгойруш і нині також Фарул, де Фора або Роша-ду-Нордешті, да Фонті або Фонті-да-Арея і ді Ферру (див. кожне з цих імен).\n\nУ групі Дезерташ знаходиться острівець Фурільян або Прегу-ду-Мар (див. ці назви), також відомий як острівець Навіу.",
    "categories": [
        "geography"
    ],
    "freguesias": [],
    "locations": {
        "Мис Сан-Лоренсу": [
            "Дезембаркадуруш і де Фора"
        ],
        "Санта-Круш": [
            "Санта-Катаріна"
        ],
        "Фуншала": [
            "Ільєу"
        ],
        "Сан-Мартінью": [
            "Ґорґулью і Прая"
        ],
        "Кампанаріу": [
            "Кампанаріу або Лапа"
        ],
        "Мис Парґу": [
            "Ґвінчу"
        ],
        "Порту-ду-Моніш": [
            "Молі і Неґру"
        ],
        "Рібейра-да-Жанела": [
            "Рібейра-да-Жанела"
        ],
        "Сейшал": [
            "Серулаш і Ґвінчу"
        ],
        "Боавентура": [
            "Прету і Вермелью"
        ],
        "Сан-Жоржі": [
            "Сан-Жоржі"
        ],
        "Сантана": [
            "Роша-ду-Навіу"
        ],
        "Файал": [
            "Головний острівець Файал"
        ],
        "Порту-да-Круш": [
            "Порту-да-Круш"
        ],
        "Порту-Санту": [
            "Сенураш, Байшу або да Кал, Сіма або душ Драгойруш, Фарул, де Фора або Роша-ду-Нордешті, да Фонті або Фонті-да-Арея, ді Ферру"
        ],
        "Дезерташ": [
            "Фурільян або Прегу-ду-Мар, острівець Навіу"
        ]
    },
    "people": {},
    "years": {}
}