{
    "id": 1831,
    "lang": "ua",
    "is_original": false,
    "title": "Муніципальний сад",
    "fl": "М",
    "original_title": "Jardim Municipal",
    "body": "21 лютого 1878 року муніципальна рада Фуншала призначила комісію радників, відповідальну за створення садів на території колишнього монастиря Святого Франциска та на ділянці між цією територією та Площею Конституції, під наглядом губернатора. Ділянка на захід від Площі Конституції була облаштована садом незабаром після цього, але роботи на території монастиря Святого Франциска розпочалися лише у серпні 1880 року. Проект і план саду, який там існує, був затверджений муніципальною радою 15 вересня 1881 року. Для фінансування цих робіт рада спочатку виділила 15 тисяч контос, перенаправлених з позики у розмірі 69 980$000 реалів, отриманої у 1883 році від Загальної кредитної компанії, а потім 19 980$000 реалів з іншої позики, отриманої в наступному році в тієї ж компанії.\n\nУ жовтні 1880 року, коли проводилися перші роботи на території колишнього монастиря Святого Франциска, як сказано в документі того часу, «був знайдений камінь, що слугував кришкою невеликого отвору, висіченого в іншому камені, в якому знайшли залишки, схожі на зіпсований пергамент». Камінь або кришку було наказано помістити в муніципальний архів, де її, втім, не знайдено. На ній був такий напис золотими літерами:\n\n> Д. Марія. I. Королева Португалії. Папа Пій VI. О. Бернард \nН. Е. П. Д. У. С. К. «Липень 1780».\n\n1 жовтня 1885 року рада дала новому саду назву Муніципальний сад, але 6 вересня 1897 року ця назва була замінена на Сад Доньї Амелії, яка зберігалася до 27 жовтня 1910 року, коли було вирішено повернути назву, дану в 1885 році. 21 березня 1902 року там було відкрито електричне освітлення, а в 1916 році воно було покращене, оскільки в 1911 році було визнано, що дроти для передачі енергії перебувають у поганому стані.\n\n28 березня 1921 року о п'ятій годині вечора за великої кількості глядачів відбулася церемонія закладення першого каменя пам'ятника, який пан Енріке Вієйра де Кастро збирається спорудити в Муніципальному саду на честь льотчиків, які вперше здійснили рейс Лісабон-Мадейра. Після підписання протоколу присутніми посадовими особами він разом з деякими монетами був поміщений у залізний контейнер, який губернатор розмістив у фундаменті споруди (1921).\n\nПерші рослини, завезені в Муніципальний сад, прибули з Парижа, пізніше надійшли інші з Порту та деяких інших місць. Серед видів, які зараз там ростуть, варто особливо відзначити *Pritchardia filifera*, *Phoenix canariensis* та *Trachycarpus excelsus* - дуже декоративні пальми, *Dammara australis* та *Ginkgo biloba* - широколисті хвойні, а також *Wigandia macrophylla*, *Astrapaea Wallichii*, *Jossinia tinifolia*, *Plumiera lutea*, *Pterocarya japonica*, *Negundo fraxinifolium* та *Alsophila excelsa*. 29 серпня 1888 року рада вирішила придбати двадцять дев'ять вітражів для створення оранжереї, яка досі існує в Муніципальному саду і де ростуть деякі цікаві види, зокрема бегонії та антуріуми. Земля та будівлі монастиря Святого Франциска, де розташований Муніципальний сад, були передані муніципалітету указом від 7 листопада 1844 року.",
    "categories": [
        "history",
        "culture"
    ],
    "freguesias": [],
    "locations": {},
    "people": {},
    "years": {
        "1878": [
            "Муніципальна рада Фуншала призначила комісію радників"
        ],
        "1880": [
            "Роботи на території монастиря Святого Франциска розпочалися"
        ],
        "1881": [
            "Проект і план саду, який там існує, був затверджений муніципальною радою"
        ],
        "1883": [
            "Позики у розмірі 69 980$000 реалів"
        ],
        "1885": [
            "Рада дала новому саду назву Муніципальний сад"
        ],
        "1897": [
            "Ця назва була замінена на Сад Доньї Амелії"
        ],
        "1902": [
            "Там було відкрито електричне освітлення"
        ],
        "1910": [
            "Вирішено повернути назву, дану в 1885 році"
        ],
        "1911": [
            "Було визнано, що дроти для передачі енергії перебувають у поганому стані"
        ],
        "1916": [
            "Воно було покращене"
        ],
        "1921": [
            "Відбулася церемонія закладення першого каменя пам'ятника"
        ]
    }
}