{
    "id": 2591,
    "lang": "ua",
    "is_original": false,
    "title": "Судова організація",
    "fl": "С",
    "original_title": "Organização Judicial",
    "body": "За часів абсолютизму весь Мадейрський архіпелаг становив один округ, головним містом якого був Фуншал, з королівським прокурором та суддею, призначеними королем. Цей самий округ був поділений на п'ять судових округів, кожен зі своїм звичайним суддею, а саме: Машику, Санта-Круш, Понта-ду-Сол, Кальєта та Сан-Вісенте. Також був суддя у справах бідних та три сирітських судді - один у Фуншалі, інший у Кальєті і третій у Сан-Вісенте. Всіма цими посадами керувала Судова рада (див. цю назву), яка вирішувала, як ми десь читали, всі кримінальні справи, за які передбачалося покарання не більше десяти років заслання, і рішення якої можна було оскаржити у вищих судах Королівства у Лісабоні.\n\n15 жовтня 1835 року закінчився старий судовий режим, було створено два судові округи з центром у Фуншалі, кожен зі своїм суддею, а в 1838 році ці судові округи стали називатися округами - східним та західним. Перший складався з чотирьох, а другий - з п'яти судових округів, кожен з яких очолював звичайний суддя. Східний округ простягався від парафії Се до парафії Арко-де-Сан-Жорже, охоплюючи також острів Порту-Санту. Західний округ простягався від парафії Сан-Педру до парафії Понта-Делгада і Боавентура, яка раніше входила до парафії Арко-де-Сан-Жорже. 27 травня 1838 року відбулися вибори звичайних суддів до новостворених судових округів, і в мадейрській газеті Chronica за 1838 рік наведено, як парафії були розподілені між цими судовими округами.\n\nУказом від 12 листопада 1875 року в Фуншалі було створено чотири судові округи, і тепер суди миру цих округів організовані таким чином:\n\nФуншальський округ. Має дев'ять судів: Сан-Педру з парафіями Сан-Педру та Сан-Роке; Се з парафіями Се, Санта-Лузія та Монте; Санта-Марія-Майор з парафіями Санта-Марія-Майор та Сан-Гонсалу; Кампанаріу з парафіями Кампанаріу та Кінта-Гранде; а також Сан-Мартінью, Санту-Антоніу, Камара-де-Лобуш, Ештрейту-де-Камара-де-Лобуш та Порту-Санту з однойменними парафіями.\n\nПонта-ду-Сол округ. Має п'ять судів: Понта-ду-Сол з парафіями Понта-ду-Сол, Каньяш та Мадалена-ду-Мар; Рібейра-Брава з парафіями Рібейра-Брава, Табуа та Серра-де-Агуа; Кальєта з парафіями Кальєта та Арко-да-Кальєта; Ештрейту-да-Кальєта з парафіями Ештрейту-да-Кальєта, Жардін-ду-Мар та Празереш; і Понта-ду-Паргу з парафіями Понта-ду-Паргу, Фажа-да-Овелья, Паул-ду-Мар та Ашадаш-да-Круш.\n\nСан-Вісенте округ. Має п'ять судів: Сан-Вісенте з однойменною парафією; Порту-Моніш з парафіями Сейшал, Рібейра-да-Жанела та Порту-Моніш; Понта-Делгада з парафіями Понта-Делгада та Боавентура; Сан-Жорже з парафіями Сан-Жорже та Арко-де-Сан-Жорже; і Сантана з парафіями Сантана, Файал та Сан-Роке-ду-Файал.\n\nСанта-Круш округ. Має чотири суди: Канісу з парафіями Канісу та Камача; Машику з парафіями Машику, Канісал, Агуа-де-Пена (частина) та Санту-Антоніу-да-Серра (частина); Порту-да-Круш з однойменною парафією; і Санта-Круш з парафіями Санта-Круш, Гаула, Агуа-де-Пена (частина) та Санту-Антоніу-да-Серра (частина).\n\nКолишні звичайні судді, які працювали в судах, були скасовані указом від 29 липня 1886 року.\n\nСудова організація, про яку йдеться вище, була істотно змінена після скасування Сан-Вісенте округу указом від 9 червня 1927 року. У 1931 році був створений муніципальний суд, що охоплює три парафії громади.",
    "categories": [
        "politics"
    ],
    "freguesias": [],
    "locations": {
        "Фуншал": [
            "Головним містом округу був Фуншал"
        ],
        "Лісабон": [
            "Рішення якої можна було оскаржити у вищих судах Королівства у Лісабоні"
        ],
        "Порту-Санту": [
            "Охоплюючи також острів Порту-Санту"
        ]
    },
    "people": {},
    "years": {
        "1835": [
            "15 жовтня 1835 року закінчився старий судовий режим"
        ],
        "1838": [
            "А в 1838 році ці судові округи стали називатися округами"
        ],
        "1875": [
            "Указом від 12 листопада 1875 року в Фуншалі було створено чотири судові округи"
        ],
        "1886": [
            "Колишні звичайні судді, які працювали в судах, були скасовані указом від 29 липня 1886 року"
        ],
        "1927": [
            "Судова організація, про яку йдеться вище, була істотно змінена після скасування Сан-Вісенте округу указом від 9 червня 1927 року"
        ],
        "1931": [
            "У 1931 році був створений муніципальний суд, що охоплює три парафії громади"
        ]
    }
}