{
    "id": 3110,
    "lang": "ua",
    "is_original": false,
    "title": "Родрігес (Адольфо де Соуза)",
    "fl": "Р",
    "original_title": "Rodrigues (Adolfo de Sousa)",
    "body": "Цей видатний художник, якому передчасна смерть і наполеглива хвороба останніх років його життя не дозволили проявити всю міць свого таланту, народився у Фуншалі 13 січня 1867 року і помер у місті Лісабон 9 березня 1908 року.\n\nВін закінчив Академію витончених мистецтв, де завжди отримував високі оцінки, виділяючись у вивченні історичного живопису, в якому він виграв першу премію з картиною Герой та Леандр. Він вивчав цю спеціальність з Жозе Феррейрою Шавесом, а потім поїхав до Парижа вдосконалюватися з Полем Лораном та Бенжаменом Констаном. На другому році навчання в Академії він також отримав премію «Благовіщення». На виставці Художньої гільдії в Лісабоні він виграв третю медаль у 1895 році. Він брав участь у різних виставках, де були представлені, серед інших, його картини Спокуса Христа та Добрий самарянин.\n\nВін намалював портрет короля Карлоса I, який був у залі засідань муніципалітету Фуншала, портрет нашого видатного співвітчизника Агоштінью ді Орнелаш і Вашконселуша тощо, і мав академічні пальми Французької академії та Орден Ізабелли Католички Іспанії.",
    "categories": [
        "art"
    ],
    "freguesias": [],
    "locations": {
        "Фуншал": [
            "Народився у Фуншалі"
        ],
        "Лісабон": [
            "Помер у місті Лісабон"
        ]
    },
    "people": {
        "Адольфо де Соуза Родрігес": [
            "Видатний художник"
        ],
        "Жозе Феррейра Шавес": [
            "Вивчав цю спеціальність з Жозе Феррейрою Шавесом"
        ],
        "Поль Лоран": [
            "Вдосконалюватися з Полем Лораном"
        ],
        "Бенжамен Констан": [
            "Вдосконалюватися з Бенжаменом Констаном"
        ],
        "Карлос I": [
            "Портрет короля Карлоса I"
        ],
        "Агоштінью ді Орнелаш і Вашконселуш": [
            "Портрет нашого видатного співвітчизника Агоштінью ді Орнелаш і Вашконселуша"
        ]
    },
    "years": {
        "1867": [
            "Народився"
        ],
        "1908": [
            "Помер"
        ],
        "1895": [
            "Виграв третю медаль у 1895 році"
        ]
    }
}